Document Number,Document Title,Document Date,Cancelled/Superceding Document,Cancelled/Superceding Date
Z-F-1742/5A,"Berries, Canned",25-May-1973,,Cancelled Date: 22-Jun-1984
Z-F-1742/4B,"Apricots, Canned",22-Jan-1975,,Cancelled Date: 22-Jun-1984
Z-F-1742/3A,"Applesauce, Canned",25-May-1973,,Cancelled Date: 22-Jun-1984
Z-F-1742/2B,Apple Butter,7-Oct-1974,,Cancelled Date: 22-Jun-1984
Z-F-1742/1A,"Apples, Canned",25-May-1973,,Cancelled Date: 22-Jun-1984
Z-F-356A(1),"Figs, Dried (or Evaporated)",4-Dec-1950,,Cancelled Date: 22-Jun-1984
Z-C-2104,Candy and Chocolate Connections,13-Jun-1979,,Cancelled Date: 22-Apr-1977
Z-C-1847,"Cranberry Juice Cocktail, Concentrate, Frozen",10-Apr-1974,,Cancelled Date: 19-Jun-1987
Z-A-641A,"Apricots, Frozen",2-Apr-1952,,Cancelled Date: 11-Apr-1978
Z-A-636C,Apricots; Evaporated (or Dried),21-Sep-1976,,Cancelled Date: 28-Aug-1978
Z-A-634A,"Apricots, Dehydrated (Low-Moisture)",15-Aug-1961,,Cancelled Date: 22-Jun-1984
Z-A-613D(1),"Apples, Dried (or Evaporated)",14-Aug-1957,,Cancelled Date: 17-Jan-1980
Z-A-612D,"Apples, Dehydrated (Low Moisture)",23-Aug-1978,,Cancelled Date: 22-Jun-1984
Y-W-50C,"Walnuts, English (Persian), Shelled Fresh",12-Jul-1974,,Cancelled Date: 22-Jun-1984
Y-S-729,"Strawberries, Fresh",23-Jan-1952,,Cancelled Date: 6-Aug-1985
Y-S-726E(2),"Strawberries, Fresh",27-Feb-1968,,Cancelled Date: 8-Oct-1975
Y-R-104,"Raspberries, Frozen",23-Jan-1952,,Cancelled Date: 8-Oct-1975
Y-P-002194,"Pineapple, Diced, Thermostabilized, Tray Pack",12-Dec-1983,,Cancelled Date: 8-Oct-1975
Y-P-190C,"Pecans, Shelled, Fresh",14-Oct-1976,,Cancelled Date: 22-Jul-1988
Y-O-451G,Olives,11-Mar-1980,,Cancelled Date: 6-Aug-1985
Y-N-711F,"Nuts (Unshelled), Assorted or Mixed",21-Dec-1976,,Cancelled Date: 22-Jun-1984
Y-G-1948,"Grapefruit and Orange Sections, Chilled",8-Jul-1977,,Cancelled Date: 6-Aug-1985
Y-F-002138,"Pears, Sliced, Thermostabilized, Tray Pack",30-Sep-1982,,Cancelled Date: 21-May-1986
Y-F-002137,"Peaches, Sliced, Thermostabilized, Tray Pack",30-Jun-1982,,Cancelled Date: 22-Jul-1988
Y-F-1741A/GEN,"Fruits, Fresh",12-Apr-1974,,Cancelled Date: 22-Jul-1988
Y-F-1741/20A,"Tangerines, Fresh",12-Apr-1974,,Cancelled Date: 14-Mar-1983
Y-F-1741/19A,"Strawberries, Fresh",12-Apr-1974,,Cancelled Date: 14-Mar-1983
Y-F-1741/18A,"Raspberries, Fresh",12-Apr-1974,,Cancelled Date: 14-Mar-1983
Y-F-1741/17A,"Plums and Prunes, Fresh",12-Apr-1974,,Cancelled Date: 14-Mar-1983
Y-F-1741/16A,"Pineapple, Fresh",12-Apr-1974,,Cancelled Date: 14-Mar-1983
Y-F-1741/14A,"Peaches, Fresh",12-Apr-1974,,Cancelled Date: 14-Mar-1983
Y-F-1741/13A,"Oranges, Fresh",12-Apr-1974,,Cancelled Date: 14-Mar-1983
Y-F-1741/11A,"Limes, Fresh, Persian (Tahiti)",12-Apr-1974,,Cancelled Date: 14-Mar-1983
Y-F-1741/10A,"Lemons, Fresh",12-Apr-1974,,Cancelled Date: 14-Mar-1983
Y-F-1741/9A,"Grapes, Fresh",12-Apr-1974,,Cancelled Date: 14-Mar-1983
Y-F-1741/8A,"Grapefruit, Fresh",12-Apr-1974,,Cancelled Date: 14-Mar-1983
Y-F-1741/7A,"Cranberries, Fresh",12-Apr-1974,,Cancelled Date: 14-Mar-1983
Y-F-1741/6A,"Cherries, Fresh (Sweet)",12-Apr-1974,,Cancelled Date: 14-Mar-1983
Y-F-1741/5A,"Blueberries, Fresh",12-Apr-1974,,Cancelled Date: 14-Mar-1983
Y-F-1741/4A,"Berries, Fresh (Blackberries, Boysenberries, Dewberries, Log",12-Apr-1974,,Cancelled Date: 14-Mar-1983
Y-F-1741/1A,"Apples, Fresh",12-Apr-1974,,Cancelled Date: 14-Mar-1983
Y-D-126C,Dates,3-Feb-1977,,Cancelled Date: 14-Mar-1983
Y-B-91D(2),"Bananas, Fresh",8-Jan-1965,,Cancelled Date: 22-Jun-1984
X-K-001274A(1),"Kit, Classified Document Destructor, Drum Type",24-Apr-1969,,Cancelled Date: 10-Jul-1992
QPL-X-C-51-4,"Caps; Blasting, Electric and Non-Electric",8-Dec-1967,,Cancelled Date: 15-May-1989
X-C-51A,"Cap, Blasting, Electric and Non-Electric",18-Apr-1962,,Cancelled Date: 14-Nov-1977
W-W-00650D,"Wrench, Impact, Electric",10-Nov-1993,,Cancelled Date: 14-Nov-1977
W-W-81A,"Washer, Storage Battery Post, Noncorrosive",15-Dec-1952,,Cancelled Date: 16-Apr-1999
QPL-W-T-1633-2,"Tape, Magnetic and Cartridge, for Magnetic Tape Electric Typ",5-Mar-1976,,Cancelled Date: 17-May-1962
W-T-1633A(1),"Tape, Magnetic, and Cartridge for Magnetic Tape Automatic Ty",5-Mar-1976,,Cancelled Date: 23-Jun-1980
QPL-W-T-1604-1,"Tape, Perforator Type, Polyester Base",29-Jul-1974,,Cancelled Date: 23-Jun-1980
W-T-1604A,"Tape, Perforator Type, Polyester Base",12-Sep-1973,,Cancelled Date: 29-Jul-1974
QPL-W-T-001572-3,"Tape, Recording, Audio, 1/4-Inch Magnetic Oxide-Coated",19-Feb-1974,,Cancelled Date: 16-Jan-1987
W-T-001572,"Tape, Recording, Audio, 1/4 Inch Magnetic Oxide Coated",17-May-1972,,Cancelled Date: 28-May-1999
W-T-001570(1),"Tape, Recording, Helical-Scan Video, 1/2-Inch, Magnetic Oxid",19-Aug-1976,,Cancelled Date: 28-May-1999
QPL-W-T-001567-2,"Recording, Quadruples Magnetic Oxide-Coated",14-May-1976,,Cancelled Date: 24-Jun-1980
W-T-001567,"Tape, Recording, Quadruplex Video, Magnetic Oxide-Coated",14-May-1976,,Cancelled Date: 24-Jun-1980
QPL-W-T-1553-14(1),"Tape, Recording, Instrumentation Magnetic Oxide-Coated",21-Jun-1994,,Cancelled Date: 24-Jun-1980
W-T-1553/4,"Tape, Instrumentation Recording, Magnetic Oxide-Coated, 800",12-Aug-1996,,Cancelled Date: 26-Apr-2007
W-T-1553/3,"Tape, Instrumentation Recording, Magnetic Oxide-Coated, 700",12-Aug-1996,,Cancelled Date: 26-Apr-2006
W-T-1553/2,"Tape, Instrumentation Recording, Magnetic Oxide-Coated, 345",12-Aug-1996,,Cancelled Date: 26-Apr-2007
W-T-1553/1,"Tape, Instrumentation Recording, Magnetic Oxide-Coated, 345",12-Aug-1996,,Cancelled Date: 26-Apr-2007
W-T-550D,"Toaster, Electric, Pop-Up/Pop Down, Heavy Duty, Intermittent",30-Jun-1986,,
W-T-215C,"Test Set; Generator and Voltage Regulator, Automotive",25-Aug-1969,,Cancelled Date: 13-Sep-2000
W-T-0070/5,"Tape, High Resolution- Longitudinally Oriented, Polyester Ba",26-Apr-1963,,Cancelled Date: 29-Feb-1980
W-T-0070/4,"Tape, Instrumentation Telemetering, Polyester Base",26-Apr-1963,,Cancelled Date: 19-Mar-1970
W-T-0070/3,"Tape, Instrumentation Telemetering, Cellulose Acetate Base",26-Apr-1963,,Cancelled Date: 19-Mar-1970
W-T-0070/2,"Tape, Auto Type, Polyester Base",26-Apr-1963,,Cancelled Date: 19-Mar-1970
W-T-0070/1,"Tape, Auto Type, Cellulose Acetate Base",26-Apr-1963,,Cancelled Date: 19-Mar-1970
W-T-0070,"Tapes, Recording, Sound and Instrumentation, Magnetic Oxide",8-Nov-1968,,Cancelled Date: 19-Mar-1970
QPL-W-T-0051-16,"Tape, Electronic Data Processing, 1/2 Inch, Magnetic-Oxide C",5-Apr-1978,,Cancelled Date: 19-Mar-1970
W-T-0051C(2),"Tape, Electronic Data Processing, 1/2-Inch, Magnetic Oxide-C",1-Mar-1975,,Cancelled Date: 7-Jan-1987
W-T-0045,"Tape, 1/4 Inch Digital-Recording, Magnetic Oxide-Coated, Spe",1-Dec-1963,,Cancelled Date: 7-Jan-1987
W-S-001361,"Safety Device, Fluorescent Lamp",25-Mar-1968,,Cancelled Date: 29-Sep-1976
W-S-896/3B,"Switches, Toggle, Flush Mounted, Mercury (AC) (Detail Specif",2-Jun-1993,,
W-S-896/1(1),"Switches, Toggle and Lock, Flush Mounted (AC-DC T Rated)",25-Jul-1974,,
W-S-893C,"Switch, Toggle, and Mounting Strap, (Interchangeable)",2-Apr-1964,,Cancelled Date: 18-Apr-1980
W-S-890B(1),"Switch, Snap, Miscellaneous",31-Dec-1963,,Cancelled Date: 20-Oct-1977
W-S-871B,"Switch; Knife, Open, Front-And Rear Connected",6-Jun-1963,,Cancelled Date: 28-Aug-1978
W-S-865C(1),"Switch, Box, (Enclosed), Surface Mounted",3-Sep-1959,,Cancelled Date: 21-Apr-1977
QPL-W-S-506-14,Spark Plug,27-Aug-1984,,Cancelled Date: 23-Nov-1983
W-S-506C,Spark Plug,13-Mar-1987,,Cancelled Date: 6-Apr-1987
W-S-90C,"Saw, Reciprocating, Portable, Electric",14-Jun-1995,,Cancelled Date: 15-Apr-1988
W-R-001404B(2),"Recorder-Reproducer, Sound (Portable, Battery/AC Powered, Ca",4-Feb-1972,,Cancelled Date: 15-Sep-1998
W-R-200A,"Report System, Watchman's",25-Nov-1957,,Cancelled Date: 27-Jun-1980
QPL-W-R-175-18(1),"Reels and Hubs and Magnetic Recording Tape,",1-Jun-1993,,Cancelled Date: 24-Aug-1973
W-R-175D/GEN(1),"Reel and Hub for Magnetic Recording Tape, General Specificat",22-Dec-1986,,Cancelled Date: 13-Feb-1998
W-R-175/6A(1),"Reels, Precision, Glass Flange With Aluminum Hub, 3-Inch Cen",22-Dec-1986,,Cancelled Date: 13-Feb-1998
W-R-175/5A,"Reels, Aluminum, for 2-Inch Video Magnetic Recording Tape (D",12-Oct-1970,,Cancelled Date: 13-Feb-1998
W-R-175/4D(1),"Reels, Precision, Aluminum, With 3-Inch Center Hole",22-Dec-1986,,Cancelled Date: 10-May-1973
Z-F-1743/4B,"Grapefruit, Frozen",18-Dec-1974,,Cancelled Date: 22-Jun-1984
Z-F-1743/3B,"Cherries, Frozen",18-Nov-1974,,Cancelled Date: 22-Jun-1984
Z-F-1743/2B,"Berries, Frozen",10-Jan-1975,,Cancelled Date: 22-Jun-1984
Z-F-1743/1B,"Apples, Frozen",10-Jan-1975,,Cancelled Date: 22-Jun-1984
Z-F-1742A/GEN,"Fruits and Fruit Juices, and Related Products Canned and Gla",25-May-1973,,Cancelled Date: 22-Jun-1984
Z-F-1742/25B,"Prunes, Canned",14-Mar-1975,,Cancelled Date: 22-Jun-1984
Z-F-1742/24B,"Plums, Canned",22-Jan-1975,,Cancelled Date: 22-Jun-1984
Z-F-1742/23B,"Pineapple, Canned",28-Mar-1975,,Cancelled Date: 22-Jun-1984
Z-F-1742/22B,"Pears, Canned",22-Jan-1975,,Cancelled Date: 22-Jun-1984
Z-F-1742/21B,"Peaches, Canned",4-Feb-1975,,Cancelled Date: 22-Jun-1984
Z-F-1742/20C,"Marmalade, Orange",14-Jul-1975,,Cancelled Date: 22-Jun-1984
Z-F-1742/19A,"Juice, Pineapple, Canned",25-May-1973,,Cancelled Date: 22-Jun-1984
Z-F-1742/18A,"Juice, Orange Concentrated, Canned",25-May-1973,,Cancelled Date: 22-Jun-1984
Z-F-1742/17A,"Juice, Orange, Canned",25-May-1973,,Cancelled Date: 22-Jun-1984
Z-F-1742/16A,"Juice, Lemon, Canned",25-May-1973,,Cancelled Date: 22-Jun-1984
Z-F-1742/15A,"Juice, Grapefruit and Pineapple, Canned",25-May-1973,,Cancelled Date: 22-Jun-1984
Z-F-1742/14B,"Juice, Grapefruit, Canned",26-Mar-1975,,Cancelled Date: 29-May-1975
Z-F-1742/13A,"Juice, Grapefruit and Orange, Canned",25-May-1973,,Cancelled Date: 22-Jun-1984
W-R-175/3D(1),"Reels, Plastic, Fiberglass, Metallic Flange Phenolic, Hub, W",22-Dec-1986,,Cancelled Date: 13-Feb-1998
W-R-175/2D(1),"Reel Hubs, Fiberglass and Metallic, With 3 Inch Center Hole",22-Dec-1986,,Cancelled Date: 13-Feb-1998
W-R-175/1D(1),"Reels, Plastic and Fiberglass, With 5/16 Inch Center Hole",22-Dec-1986,,Cancelled Date: 13-Feb-1998
W-R-170A,"Recorder-Reproducer, Sound (Portable, Battery Operated)",16-May-1966,,Cancelled Date: 13-Feb-1998
W-R-130A,"Receiver-Transmitter, Radio (Mobile Station Type)",3-Feb-1966,,Cancelled Date: 5-Feb-1973
W-R-125A,"Receiver-Transmitter, Radio (Portable Type)",14-Jan-1966,,Cancelled Date: 4-Jun-1976
W-R-101H,"Ranges, Electric (Domestic)",1-Mar-1995,,Cancelled Date: 4-Jun-1976
W-R-41B,"Raceways and Fittings; Nonmetallic, Underfloor",7-Mar-1957,,Cancelled Date: 19-Feb-1998
W-P-001251A,"Power Supply, Cautery Apparatus",30-Oct-1973,,Cancelled Date: 31-Jul-1963
W-P-790A,"Public Address Set (Lectern Type, Portable)",28-Feb-1964,,
W-P-785A,Public Address Set (Electronic Megaphone Type),22-Apr-1964,,Cancelled Date: 1-Aug-1974
W-P-115C,"Panel, Power Distribution",14-Mar-1990,,Cancelled Date: 12-Apr-1976
W-P-66B,"Pads; Heating, Electric",13-May-1957,,Cancelled Date: 6-Sep-2001
W-O-745,"Oscilloscope, General Purpose, 5-Inch, Dual Trace Dc-24Mc,(",13-Jun-1961,,Cancelled Date: 1-Aug-1975
W-O-740,"Oscilloscope, General Purpose, 5-Inch, Dc-15Mc (Type 1)",6-Jul-1961,,Cancelled Date: 15-Dec-1971
W-O-735,"Oscilloscope, General Purpose, 3-Inch, 10Cps-4Mc, (Type 1)",13-Jun-1961,,Cancelled Date: 15-Dec-1971
W-O-730,"Oscilloscope, General Purpose, 3-Inch, Dc-2Mc, (Type 1)",19-Jun-1961,,Cancelled Date: 15-Dec-1971
W-O-725,"Oscilloscope, for General Purpose Use, General Specification",6-Jun-1961,,Cancelled Date: 15-Dec-1971
W-M-1496A,"Monitors, Television, Monochrome (Direct View, Video)",8-Nov-1972,,Cancelled Date: 15-Dec-1971
W-M-780,Multimeter,26-Apr-1965,,Cancelled Date: 19-Apr-1978
W-M-340A,"Microphone, Dynamic",29-Apr-1966,,Cancelled Date: 17-May-1977
W-M-221,"Metabolism-Testing Apparatus, Motor Driven",4-May-1951,,Cancelled Date: 3-Dec-1976
W-L-001418(1),Flashlight (Penlight),9-Jul-1968,,Cancelled Date: 20-Aug-1975
W-L-001289,"Lamp Incandescent (Electric, Medical Instrument Tungsten-Fil",28-Feb-1967,,Cancelled Date: 10-Feb-1995
W-L-661E,"Light, Extension, Electrical",31-Mar-1994,,Cancelled Date: 12-Jul-1978
W-L-318,"Lights, Operating-Room, Mobile",5-Jun-1950,,Cancelled Date: 5-Jan-1998
W-L-317B,"Light, Marker, Ground Obstruction",23-Jul-1963,,Cancelled Date: 31-Oct-1973
W-L-314/7,"Light, Household, Junior Floor, Type XVIII",6-May-1980,,
W-L-314/3,"Light, Household, Large Floor, Type XIII",6-May-1980,,Cancelled Date: 9-Mar-1987
W-L-00313,"Light, Extension, Electrical, Fluorescent",4-Feb-1963,,Cancelled Date: 9-Mar-1987
W-L-312C,"Lights, Floor and Desk, Fluorescent, Swinging Arm",25-Feb-1985,,Cancelled Date: 12-Jul-1978
W-L-00215B,"Lantern, Electric, Head",7-Jan-1977,,Cancelled Date: 15-Jun-1995
QPL-W-L-215-1,"Lantern, Electric Head",13-Nov-1958,,Cancelled Date: 17-Mar-1995
W-L-215(2),"Lantern, Electric, Head",13-Nov-1958,,Cancelled Date: 17-Mar-1995
W-L-00200C(2),"Lantern, Electric",7-Aug-1968,,Cancelled Date: 17-Mar-1995
W-L-200(2),"Lantern, Electric",18-Nov-1955,,Cancelled Date: 27-Apr-1995
W-L-126A(1),"Lamp, Incandescent, Projection",27-Feb-1959,,Cancelled Date: 27-Apr-1995
W-L-124A,"Light, Vehicular",24-Oct-1966,,Cancelled Date: 20-Mar-1984
W-L-122C,"Lamp, Photoflash",18-Apr-1973,,Cancelled Date: 1-Dec-1977
W-L-00116/37A,"Lamp Fluorescent Trade No. F48T12/Ww, Instant Start, 40 Watt",27-May-1976,,
W-L-00116/33A,"Lamp Fluorescent Trade No. F96T12/Cw/Ho, Rapid Start, 105 Wa",27-May-1976,,
QPL-W-L-101-9,"Lamp, Incandescent (Electric, Large, Tungsten Filament)",30-Oct-1980,,Cancelled Date: 15-Dec-1969
W-L-00111/64A,"Lamp, Incandescent, Miniature Trade No. 1156, S-8 Clear Bulb",15-Sep-1977,,Cancelled Date: 5-Oct-1990
W-L-00111/63,"Lamp Incandescent Sub-Miniature Trade No. 370, T-1 3/4 Clear",12-Apr-1976,,Cancelled Date: 5-Oct-1990
W-L-00111/62A,"Lamp, Incandescent, Sub-Miniature Trade No. T-1-3/4 Clear Bu",15-Sep-1977,,Cancelled Date: 5-Oct-1990
W-L-00111/61,"Lamp, Incandescent, Miniature Trade No. 53, G-3 1/2 Clear Bu",12-Apr-1976,,Cancelled Date: 5-Oct-1990
W-L-00111/60,"Lamp, Incandescent, Miniature Trade No. 67, G-6 Clear Bulb,",12-Apr-1976,,Cancelled Date: 5-Oct-1990
W-L-00111/59A,"Lamp, Incandescent, Miniature Trade No. 1819, T-3 1/4 Clear",12-Apr-1976,,Cancelled Date: 5-Oct-1990
W-L-00111/58A,"Lamp, Incandescent, Miniature Trade No. 1'34, S-8 Clear Bulb",15-Sep-1977,,Cancelled Date: 30-Oct-1990
W-L-00111/57,"Lamp, Incandescent, Miniature Trade No. 1829, T-3 1/4 Clear",21-Apr-1975,,Cancelled Date: 30-Oct-1990
W-L-00111/56,"Lamp, Incandescent, Sub-Miniature Trade No. 1769, T-1 3/4 Cl",21-Apr-1975,,Cancelled Date: 30-Oct-1990
W-L-00111/55,"Lamp Incandescent, Trade No. 1768, T-1 3/4 Clear Bulb, Midge",21-Apr-1975,,Cancelled Date: 5-Oct-1990
W-L-00111/54,"Lamp, Incandescent, Sub-Miniature Trade No. 1767, T-1 3/4 Cl",21-Apr-1975,,Cancelled Date: 5-Oct-1990
W-L-00111/53,"Lamp, Incandescent, Miniature, Trade No. 1692, S-8 Clear Bul",21-Apr-1975,,Cancelled Date: 30-Oct-1990
W-L-00111/52,"Lamp, Incandescent, Miniature Trade No. 1611, S-8 Clear Bulb",21-Apr-1975,,Cancelled Date: 5-Oct-1990
W-L-00111/51A,"Lamp, Incandescent, Miniature Trade No. 1495, T 4-1/2, Clear",2-Nov-1977,,Cancelled Date: 5-Oct-1990
W-L-00111/50,"Lamp, Incandescent, Miniature Trade No. 1252, G-6 Clear Bulb",21-Apr-1975,,Cancelled Date: 5-Oct-1990
W-L-00111/49,"Lamp, Incandescent, Miniature Trade No. 1204, S-8 Clear Bulb",21-Apr-1975,,Cancelled Date: 5-Oct-1990
W-L-00111/48A,"Lamp, Incandescent, Miniature Trade No. 1157, S-8 Clear Bulb",15-Sep-1977,,Cancelled Date: 5-Oct-1990
W-L-00111/47,"Lamp, Incandescent, Miniature Trade No. 1047, Rp-11 Clear Bu",21-Apr-1975,,Cancelled Date: 30-Oct-1990
W-L-00111/46,"Lamp, Incandescent, Sub-Miniature Trade No. 342, T-1 3/4 Cle",21-Apr-1975,,Cancelled Date: 5-Oct-1990
W-L-00111/45,"Lamp, Incandescent, Sub-Miniature Trade No. 335, T-1 3/4 Cle",21-Apr-1975,,Cancelled Date: 30-Oct-1990
W-L-00111/44A,"Lamp, Incandescent, Miniature Trade No. 173, S-8 Clear Bulb,",15-Sep-1977,,Cancelled Date: 5-Oct-1990
W-L-00111/43,"Lamp, Incandescent, Sub-Miniature Trade No. 331, T-1 3/4 Cle",21-Apr-1975,,Cancelled Date: 5-Oct-1990
W-L-00111/42,"Lamp, Incandescent, Miniature Trade No. 311, S-11 Clear Bulb",21-Apr-1975,,Cancelled Date: 5-Oct-1990
W-L-00111/41A,"Lamp, Incandescent, Miniature Trade No. 57, G-4-1/2 Clear Bu",15-Sep-1977,,Cancelled Date: 30-Oct-1990
W-L-00111/40A,"Lamp, Incandescent, Miniature Trade No. 47, T-3-1/4 Clear Bu",15-Sep-1977,,Cancelled Date: 5-Oct-1990
W-L-00111/39A,"Lamp, Incandescent, Miniature Trade No. 44 T-3-1/4 Clear Bul",15-Sep-1977,,Cancelled Date: 5-Oct-1990
W-L-00111/38,"Lamp, Incandescent, Miniature Trade No. 14, G-3 1/2 Clear Bu",21-Apr-1975,,Cancelled Date: 5-Oct-1990
W-L-00111/37,"Lamp, Incandescent, Miniature Trade No. Pr-9, B-3 1/2 Clear",21-Apr-1975,,Cancelled Date: 5-Oct-1990
W-L-00111/36,"Lamp, Incandescent, Miniature Trade No. Pr-6, B-3 1/2 Clear",21-Apr-1975,,Cancelled Date: 5-Oct-1990
W-L-00111/35,"Lamp, Incandescent, Miniature Trade No. Pr-3, B-3 1/2 Clear",21-Apr-1975,,Cancelled Date: 30-Oct-1990
W-L-00111/34,"Lamp, Incandescent, Miniature Trade No. Pr-2, B-3 1/2 Clear",21-Apr-1975,,Cancelled Date: 30-Oct-1990
W-L-00111/33A,"Lamp, Incandescent, Sub Miniature, Trade No. 715, T-1 Clear",15-Sep-1977,,Cancelled Date: 5-Oct-1990
W-L-00111/32A,"Lamp, Incandescent, Sub-Miniature Trade No. 713 T-1 Clear Bu",14-May-1976,,Cancelled Date: 30-Oct-1990
W-L-00111/31,"Lamp, Incandescent, Sub-Miniature Trade No. 683, T-1 Clear",21-Apr-1975,,Cancelled Date: 5-Oct-1990
W-L-00111/30,"Lamp, Incandescent, Sub-Miniature Trade No. 680, T-1 Clear",21-Apr-1975,,Cancelled Date: 30-Oct-1990
W-L-00111/29A,"Lamp, Incandescent, Sub-Miniature Trade No. 718, T-1 Clear",2-Nov-1977,,Cancelled Date: 30-Oct-1990
W-L-00111/28A,"Lamp, Incandescent, Sub-Miniature Trade No. 714, T-1, Clear",2-Nov-1977,,Cancelled Date: 5-Oct-1990
W-L-00111/27A,"Lamp, Incandescent, Sub-Miniature Trade No. 685, T-I Clear",2-Nov-1977,,Cancelled Date: 5-Oct-1990
W-L-00111/26A,"Lamp, Incandescent, Sub-Miniature Trade No. 682, T-1 Clear",2-Nov-1977,,Cancelled Date: 5-Oct-1990
W-L-00111/25,"Lamp, Incandescent, Miniature Trade No. 1251, G-6 Clear Bulb",21-Apr-1975,,Cancelled Date: 5-Oct-1990
W-L-00111/24,"Lamp, Incandescent, Miniature Trade No. 303, G-6 Clear Bulb,",21-Apr-1975,,Cancelled Date: 5-Oct-1990
W-L-00111/22,"Lamp, Incandescent, Sub-Miniature Trade No. 7153, T-3/4 Clea",21-Apr-1975,,Cancelled Date: 5-Oct-1990
W-L-00111/21,"Lamp, Incandescent, Sub-Miniature Trade No. 7133, T-3/4 Clea",21-Apr-1975,,Cancelled Date: 5-Oct-1990
W-L-00111/20,"Lamp, Incandescent, Sub-Miniature Trade No. 6833, T-3/4 Clea",21-Apr-1975,,Cancelled Date: 30-Oct-1990
W-L-00111/19,"Lamp, Incandescent, Sub-Miniature Trade No. 6803, T-3/4 Clea",21-Apr-1975,,Cancelled Date: 5-Oct-1990
W-L-00111/18,"Lamp, Incandescent, Sub-Miniature Trade No. 7152, T-1 Clear",21-Apr-1975,,Cancelled Date: 5-Oct-1990
W-L-00111/17,"Lamp, Incandescent, Sub-Miniature Trade No. 7132, T-1 Clear",21-Apr-1975,,Cancelled Date: 30-Oct-1990
W-L-00111/6,"Lamp, Incandescent, Sub-Miniature Trade No. 338, T-1 3/4 Cle",21-Apr-1975,,Cancelled Date: 5-Oct-1990
W-L-00111/1,"Lamp, Incandescent, Sub-Miniature Trade No. 327, T-1 3/4 Cle",21-Apr-1975,,Cancelled Date: 15-Sep-1990
W-L-111C(7),"Lamp, Incandescent, (Electric Miniature, Tungsten-Filament)",11-Feb-1958,,Cancelled Date: 30-Aug-1990
W-L-77A(1),"Lamp, Incandescent, (Sealed-Reflector, Signal, Par36 Bulb,",3-Nov-1959,,
W-L-00116/4C,"Lamp, Fluorescent Trade No. F8Ts/W, Preheat, 8 Watt, T-5 Bul",26-May-1976,,
W-L-00116/2B,"Lamp, Fluorescent Trade No. F6T5/W, Preheat, 6 Watt, T-5 Bul",26-May-1976,,
QPL-W-L-00111-5,"Lamp, Incandescent (Electric, Miniature and Subminiature, Tu",10-Nov-1980,,
W-L-00111/77,"Lamp, Incandescent (Sub-Miniature) (Trade No. 345, T-1 3/4",14-Dec-1982,,Cancelled Date: 10-Jan-1983
W-L-00111/76,"Lamp, Incandescent (Sub-Miniature) (Trade No. 334, T-1 3/4",14-Dec-1982,,Cancelled Date: 5-Oct-1990
W-L-00111/75,"Lamp, Incandescent, Sub-Miniature Trade No. 715 As15, T-1 Cl",17-Nov-1977,,Cancelled Date: 5-Oct-1990
W-L-00111/74,"Lamp, Incandescent, Sub-Miniature Trade No. 713 As15, T-1 Cl",17-Nov-1977,,Cancelled Date: 5-Oct-1990
W-L-00111/73,"Lamp, Incandescent, Sub-Miniature Trade No. As15, T-1 Clear,",17-Nov-1977,,Cancelled Date: 5-Oct-1990
W-L-00111/72,"Lamp, Incandescent, Sub-Miniature Trade No. 680 As15, T-1 Cl",17-Nov-1977,,Cancelled Date: 5-Oct-1990
W-L-00111/71,"Lamp, Incandescent, Sub-Miniature Trade No. As15, T-1 Clear,",17-Nov-1977,,Cancelled Date: 5-Oct-1990
W-L-00111/70,"Lamp, Incandescent, Sub-Miniature Trade No. 714 As15, T-1 Cl",17-Nov-1977,,Cancelled Date: 5-Oct-1990
W-L-00111/69,"Lamp, Incandescent, Sub-Miniature Trade No. 685 Asi5, T-1 Cl",17-Nov-1977,,Cancelled Date: 5-Oct-1990
W-L-00111/68A,"Lamp, Incandescent, Sub-Miniature Trade No. L82 As15, T-1 Cl",17-Nov-1977,,Cancelled Date: 5-Oct-1990
W-L-00111/67A,"Lamp, Incandescent, Miniature Trade No. 63 G-6 Clear Bulb,",15-Sep-1977,,Cancelled Date: 5-Oct-1990
W-L-00111/66A,"Lamp, Incandescent, Miniature Trade No. 89, G-6 Clear Bulb,",15-Sep-1977,,Cancelled Date: 5-Oct-1990
W-L-00111/65,"Lamp, Incandescent, Miniature Trade No. 1680, S-8 Clear Bulb",12-Apr-1976,,Cancelled Date: 5-Oct-1990
W-L-101/0097,"Lamp Incandescent 15 Watt, 130 Volts, A-15 Bulb Inside Frost",15-Jan-1969,,Cancelled Date: 15-Apr-1991
W-L-101/0096,"Lamp Incandescent 15 Watt, 120 Volts, A-15 Bulb Inside Frost",15-Jan-1969,,Cancelled Date: 15-Dec-1969
W-L-101/0093,"Lamp Incandescent 25 Watt, 115 Volts, T-10 Bulb Inside Frost",15-Jan-1969,,Cancelled Date: 15-Dec-1969
W-L-101/0082,"Lamp Incandescent 200 Watt, 115 Volts, Ps-30 Bulb Clear, Med",15-Jan-1969,,Cancelled Date: 9-Feb-1978
W-L-101/0071,"Lamp Incandescent 25 Watt, 130 Volts, A-19 Bulb Inside Frost",15-Jan-1969,,Cancelled Date: 9-Feb-1978
W-L-101/0070,"Lamp Incandescent 25 Watt, 120 Volts, A-19 Bulb Inside Frost",15-Jan-1969,,Cancelled Date: 15-Dec-1969
W-L-101/0055,"Lamp Incandescent 60 Watt, 115 Volts, A-19 Bulb Clear, Mediu",15-Jan-1969,,Cancelled Date: 15-Dec-1969
W-L-101/0032,"Lamp Incandescent 25 Watt, 125 Volts, A-19 Bulb Inside Frost",15-Jan-1969,,Cancelled Date: 9-Feb-1978
W-L-101/0023,"Lamp Incandescent 40 Watt, 125 Volts, A-19 Bulb Inside Frost",15-Jan-1969,,Cancelled Date: 15-Dec-1969
W-C-596/176,"Connector, Receptacle, Electrical, General Purpose, Single,",28-Oct-1980,,Cancelled Date: 17-Oct-1988
W-L-74A,"Lamp, Incandescent, (Sealed-Reflector, Par38 Bulb, General S",3-Nov-1959,,Cancelled Date: 12-Jul-1978
W-L-71A,"Lamp, Incandescent, (Sealed Reflector, General Service, Par",3-Nov-1959,,Cancelled Date: 2-Dec-1977
W-L-59A,"Lamp, Incandescent, (Sealed-Reflector, Automotive, Par56 Bul",3-Nov-1959,,Cancelled Date: 30-May-1989
W-L-56A,"Lamp, Incandescent, (Sealed-Reflector, Automotive, Par56 Bul",3-Nov-1959,,Cancelled Date: 21-Oct-1977
W-L-50A,"Lamp, Incandescent, (Sealed Reflector) (General Specificatio",3-Nov-1959,,Cancelled Date: 21-Oct-1977
W-J-805(2),"Junction Box and Cover, Junction Box (Non-Metallic)",20-Jul-1964,,Cancelled Date: 30-May-1989
W-I-00520(1),Intercommunication Set (Language Laboratory Type),9-May-1966,,Cancelled Date: 21-Oct-1977
W-H-2904,"Heaters, Fluid, Deaerating (For Water Only) 1,000 to 1,600,0",2-Jun-1997,,Cancelled Date: 3-Dec-1976
W-H-640,"Hotplates, Gas and Electric, Coffee-Maker",10-Apr-1967,,Cancelled Date: 29-Jan-2001
W-H-200,"Heater, Surgical Instrument Sterilizer",12-Sep-1960,,Cancelled Date: 11-Dec-2000
W-H-191B,"Heater, Heat Treatment Pad",27-May-1975,,Cancelled Date: 1-Aug-1975
W-H-190,"Heaters, Electric; Reflector, Portable (Bare Element)",29-Jan-1952,,Cancelled Date: 10-Aug-1990
W-H-00150(1),"Heater, Coolant, Engine, (Electric)",12-May-1958,,Cancelled Date: 3-Sep-1967
W-H-50B(1),"Hand Drier, Blower, Electric",11-Aug-1965,,Cancelled Date: 27-Jul-1994
W-G-2857,"Griddles, Self-Heating, Electric; And Stands, Griddle",15-Apr-1994,,Cancelled Date: 15-Mar-1999
QPL-W-G-1115-2,"Grinder, Electric, Portable, Double-Insulated (Dielectric Ho",1-Jun-1971,,Cancelled Date: 3-Jan-2002
W-G-1115A,"Grinder, Electric, Portable, Double Insulated (Dielectric Ho",30-Oct-1970,,Cancelled Date: 28-May-1980
W-G-690C,"Grinding Kits, Valve Seat, Electric",23-Jul-1985,,Cancelled Date: 31-Dec-1994
W-F-779D,"Furnace, Dental Laboratory, Electric",18-Nov-1977,,Cancelled Date: 10-Jul-1978
QPL-W-F-421-5,"Flash Lights; Electric, Hand",9-Dec-1965,,Cancelled Date: 29-Mar-1991
W-F-416(1),"Fixtures, Lighting; Major Operating (Surgical), Ceiling-Moun",2-Apr-1948,,Cancelled Date: 27-Oct-1995
W-F-414E,"Fixture, Lighting (Fluorescent, Alternating Current, Pendant",9-Feb-1973,,Cancelled Date: 1-Aug-1975
W-F-412E,"Fixtures, Lighting, Incandescent Lamp, Industrial",21-Jul-1976,,Cancelled Date: 15-Jun-1995
W-F-398B(2),"Fire Alarm System; Local, Electric, Supervised, Noncoded Typ",1-Nov-1963,,Cancelled Date: 14-May-1982
W-F-396C(2),"Fire Alarm System; Local, Electric, Supervised, Selective Co",27-Nov-1963,,Cancelled Date: 11-Nov-1977
W-F-391C(2),"Fire Alarm System; Local, Electric, Supervised, Succession",27-Nov-1963,,Cancelled Date: 19-Sep-1994
QPL-W-F-101-6,"Fan, Electric, Bracket and Desk Rigid Blades, (for Shore Use",27-Dec-1966,,Cancelled Date: 11-Dec-1989
W-E-00661B,"Eraser, Electric",15-Jan-1969,,Cancelled Date: 19-Jul-1970
W-D-001810,"Dummy Load, Electrical, Coaxial 50 Ohms Impedance, DC Up to",1-Mar-1973,,Cancelled Date: 19-Feb-1999
QPL-W-D-001663-2,"Disk-Pack, for Data Storage (Magnetic Recording, 14-Inch, 1",2-Jun-1975,,Cancelled Date: 29-Sep-1976
W-D-001663,"Disk Pack, for Data Storage (Magnetic Recording, 14 Inch, 11",2-Jun-1975,,Cancelled Date: 5-Jan-1987
W-D-001595(1),"Decollator, Paper Forms",19-Mar-1970,,Cancelled Date: 5-Jan-1987
W-D-001489,"Disk-Pack, for Data Storage (Magnetic Recording, 14-Inch, Si",10-Mar-1971,,Cancelled Date: 5-Aug-1974
QPL-W-D-1114-13,"Drills, Electric, Portable, Double-Insulated (Dielectric Hou",17-Mar-1980,,Cancelled Date: 6-Jul-1979
W-D-1114B,"Drills, Electric, Portable, Double-Insulated (Dielectric Hou",14-Jun-1995,,Cancelled Date: 28-May-1980
