Document Number,Document Title,Document Date,Cancelled/Superceding Document,Cancelled/Superceding Date
A-A-53150,"Swab, Culture (Calcium Alginate)",25-Aug-1987,,Cancelled Date: 23-Apr-1999
A-A-53106,"Applicator, Cranial Immobilization Ring",31-Aug-1987,,Cancelled Date: 29-Apr-1999
A-A-53970,"Cloxacillin Sodium for Oral Solution, USP",30-Oct-1989,,Cancelled Date: 29-Apr-1999
A-A-53966,"Cromolyn Sodium for Inhalation, USP",30-Oct-1989,,Cancelled Date: 26-Feb-1999
A-A-53566,Desonide Cream,22-Jul-1988,,Cancelled Date: 26-Feb-1999
A-A-53310A,"Dextrose Injection, USP",15-Dec-1989,,Cancelled Date: 26-Feb-1999
CCC-B-801(3),Bunting; Wool,21-Jul-1931,,
YY-P-00445,Playing Cards; Standard and Pinochile Decks,6-Nov-1964,,Cancelled Date: 6-Dec-1969
YY-H-0045,"Handball, Rubber",28-Jun-1965,,Cancelled Date: 21-Mar-1966
A-A-54007,"Polyp, Retriever, Rectal, Flexible, 3 or 4 Prong",2-Feb-1990,,
A-A-53937,"Knife, Cartilage, Curved",26-Jul-1989,,Cancelled Date: 25-Jun-1999
A-A-51494B,"Electrode, Electrocardiograph",31-Mar-1987,,Cancelled Date: 25-Jun-1999
A-A-51621A,"Holder, Leg",23-Nov-1990,,Cancelled Date: 14-Jul-1999
A-A-2074A,"Brushes, Scrub",10-Jul-1997,,
GG-M-95A,Magnifier and Reducing Glass,23-Jun-1964,,
A-A-829A,"Herbicide, Simazine",15-Sep-1988,,Cancelled Date: 30-Sep-1999
A-A-460,"Cleaning Compound, Toilet Bowl, Bisulfate",14-Feb-1980,,Cancelled Date: 29-Oct-2004
A-A-54306,Periosteotome,17-Dec-1990,,
A-A-54290,"Elevator, Zygoma, Dingman, Heavy Duty",11-Dec-1990,,Cancelled Date: 16-Jun-1999
A-A-182A,"Basket, Wastepaper, Metal",5-Feb-1993,,
A-A-343C,"Dispenser, Pressure-Sensitive Adhesive Tape (For Filament-Re",18-Jan-1996,,Cancelled Date: 4-Aug-1999
A-A-3143A,"Pillow, Bed, Shredded Urethane Form Filler",19-May-1998,,
A-A-1781A,"Paper, Crepe, Display",8-Jun-1993,,Cancelled Date: 19-Aug-1999
A-A-39A,"Detergent, General Purpose (Hard Surface Cleaner; Liquid; Co",5-Apr-1984,,Cancelled Date: 10-Aug-1999
A-A-1193B,"Hanger, Picture (Magnetic)",10-Apr-1997,,Cancelled Date: 6-Aug-1999
A-A-53772,"Mask, Oronasal",30-Nov-1988,,Cancelled Date: 5-Aug-1999
A-A-53676,"Forceps, Intestinal (Singley)",7-Sep-1988,,Cancelled Date: 2-Jul-1999
A-A-51270,"Tape, Measuring, Surgical",11-Dec-1985,,Cancelled Date: 2-Jul-1999
A-A-23,"Polish, Shoe, Paste",7-Feb-1980,,
A-A-2656,"Tab, Signal, Plastic Tab Set, Signal Plastic",9-May-1990,,Cancelled Date: 5-Aug-1999
A-A-2775,"Pencil, Indelible Lead (Hectograph)",9-Jan-1992,,Cancelled Date: 25-Aug-1999
A-A-2910,"3.05 MM Leads, For China Marking, Mechanical Pencils (Colore",29-Sep-1995,,Cancelled Date: 20-Jul-1999
A-A-1688A,"Tape, Pressure-Sensitive Adhesive (Paper, Photographic)",30-Nov-1995,,Cancelled Date: 20-Jul-1999
A-A-2810A,"Binder, Loose-Leaf, Coated Cloth Bound, Stiff Covers (For Ta",27-Dec-1996,,
A-A-3078,"Binder, Loose-Leaf, Sectional-Post-Type",16-Dec-1996,,Cancelled Date: 2-Aug-1999
A-A-163C,"Pillowcase and Cover, Headrest (Disposable)",28-Aug-1997,,Cancelled Date: 2-Aug-1999
A-A-2344A,"Wrenches, Adjustable",14-May-1985,,Cancelled Date: 27-Jul-1999
A-A-1509,"Clock, Wall Electric, Synchronous Motor",26-Mar-1981,,Cancelled Date: 23-Jul-1999
A-A-1397,"Socket, Socket Wrench, Nonpower, 1/2 Inch Drive, 8-Point",14-Dec-1982,,Cancelled Date: 21-Jul-1999
A-A-2172,"Adapter, Socket Wrench",25-May-1984,,Cancelled Date: 21-Jul-1999
A-A-1395,"Socket, Socket Wrench, Nonpower, 3/4 Inch Drive, 12 Point, L",13-Jun-1985,,Cancelled Date: 21-Jul-1999
A-A-491,"Sander-Filer, Pneumatic",27-Sep-1979,,
A-A-2483,"Screwdriver, Cross Tip (Phillips, Nonsparking and Nonmagneti",15-Aug-1988,,Cancelled Date: 21-Jul-1999
A-A-2490,"Wrench, Box (Nonsparking and Nonmagnetic)",15-Aug-1988,,Cancelled Date: 20-Jul-1999
A-A-3023,"Extractor, Screw and Drill Guide, Screw Extractor",10-Oct-1996,,Cancelled Date: 20-Jul-1999
A-A-2578,"Pot, Melting, (Nonelectric, Solder Style)",4-Aug-1988,,Cancelled Date: 20-Jul-1999
A-A-2545,Drifts; Drill,3-Sep-1987,,Cancelled Date: 20-Jul-1999
A-A-3020,"Handles, File, Wood",25-Jun-1996,,
A-A-2968,"Saw Set, Hand",27-Jun-1996,,Cancelled Date: 14-Jul-1999
A-A-2519,"Drill, Twist (Solid Carbide)",7-Dec-1987,,Cancelled Date: 14-Jul-1999
A-A-1360,"Wrench, Striking, Box 12 Point",14-Jan-1980,,Cancelled Date: 13-Jul-1999
A-A-2800A,"Cushion, Chair and Stool",25-Sep-1997,,
A-A-2507,"Chisel, Diamond Point, Hand (Nonsparking & Nonmagnetic)",15-Aug-1988,,Cancelled Date: 24-Aug-1999
A-A-2449,"File, Hand (Swiss Pattern), Needle, Barrette",2-Jun-1986,,Cancelled Date: 19-Jul-1999
A-A-2458,"Riffler, Die Sinkers (Swiss Pattern), Shape Number 4",2-Jun-1986,,Cancelled Date: 16-Jul-1999
A-A-2467,"Riffler, Die Sinkers (Swiss Pattern), Shape Number 13",2-Jun-1986,,Cancelled Date: 16-Jul-1999
A-A-1801,"Coating Compound, Obliterating (Aerosol)",28-Oct-1981,,Cancelled Date: 19-Jul-1999
QPL-TT-E-485-22,"Enamel, Semi-Gloss, Rust-Inhibiting",31-Mar-1986,,Cancelled Date: 13-Jul-1999
A-A-2752,"Ink, Writing For Fountain and Dip Pens",15-Nov-1991,,Cancelled Date: 1-Jul-1999
A-A-419A,"Ribbon, Teletypewriter",8-Jul-1998,,Cancelled Date: 23-Jul-1999
A-A-292,"Rubber Stamp, Fixed Legend",12-Oct-1979,,Cancelled Date: 23-Jul-1999
A-A-976A,"Pencil, Lead Drawing",8-May-1992,,Cancelled Date: 23-Jul-1999
A-A-54905,"Forceps, Bone Cutting, Straight",13-Aug-1993,,Cancelled Date: 29-Jul-1999
A-A-54276,"Forceps, Endoscopic, Globular Object Grasping (Jackson)",7-Nov-1990,,Cancelled Date: 4-Jun-1999
A-A-53894,"Electrode, Electrocardiograph, Infant",28-Apr-1989,,Cancelled Date: 4-Jun-1999
A-A-53625B,"Resuscitator, Hand Operated Adult, Single Use",15-Oct-1992,,Cancelled Date: 27-May-1999
A-A-53519,"Handle, Bone Cutting Saw (Gigli)",6-Jun-1988,,Cancelled Date: 27-May-1999
A-A-50992,Otoscope (Battery Type),3-Oct-1985,,Cancelled Date: 28-May-1999
A-A-2442,"File, Hand (Swiss Pattern), Needle, Round",2-Jun-1986,,
A-A-2433,"File, Hand (Swiss Pattern), Pillar, Narrow",2-Jun-1986,,Cancelled Date: 15-Jul-1999
A-A-2327,"Rasp, Hand, Horse, Plain, Regular",27-Sep-1986,,Cancelled Date: 15-Jul-1999
A-A-1040B,"Key Chain, Reel (Door Key and Drill Chuck Keys)",9-Jul-1997,,Cancelled Date: 15-Jul-1999
RR-P-395,"Plates, Dinner; Corrosion-Resisting Steel",7-May-1947,,Cancelled Date: 21-Mar-1966
A-A-877A,"Herbicide, Diuron",3-Jun-1991,,
A-A-564,"Dispenser, Gummed, Tape, Electrically Operated (Single Lengt",29-Feb-1980,,
ZZ-H-581A(1),"Hose; Tender (Locomotive), Corrugated",12-Nov-1946,,Cancelled Date: 26-Apr-1999
CCC-G-391,Gingham,28-Jun-1932,,Cancelled Date: 6-Nov-1969
A-A-3149,Penetrating Fluid,28-Jan-1999,,Cancelled Date: 25-May-1967
A-A-55546,"Fuseholder, Block, Class CC, 30 Amperes (A), 600 Volts (V) A",11-Mar-1999,,
A-A-55545/2,"Fuse Cartridge, Class CC, 600 Volts (V) AC, fast Acting, 1/1",11-Mar-1999,,Cancelled Date: 1-Aug-2003
A-A-55545/1,"Fuse Cartridge, Class CC, 600 Volts (V) AC, Time Delay, 1/1",11-Mar-1999,,Cancelled Date: 1-Aug-2003
A-A-55545,"Fuse Cartridge, Class CC, 600 Volts (V) AC, General Requirem",11-Mar-1999,,Cancelled Date: 1-Aug-2003
W-W-650C,"Wrench, Impact, Electric",22-Jun-1970,,
WW-U-536,"Unions; Malleable-Iron or Steel, 300-Pound",1-Mar-1932,,Cancelled Date: 16-Apr-1999
O-I-555A,"Insecticide, Malathion, Water-Dispersible Powder",22-Aug-1960,,Cancelled Date: 9-Jan-1969
O-I-510,"Insecticide, Aldrin, 25 Percent, Water-Dispersible Powder",10-Apr-1956,,Cancelled Date: 3-Jun-1968
A-A-51505A,"Oxacillin Sodium for Injection, USP",11-Jun-1987,,Cancelled Date: 16-Oct-1998
TT-L-50G(2),"Lacquer, Nitrocellulose, Acrylic and Acrylic-Butyrate, Aeros",17-Sep-1976,,Cancelled Date: 14-Jul-1975
A-A-2634,"Drilling Machine, Paper, Electric Motor Driven",1-Nov-1991,,
A-A-30111F,Tracheostomy Care Type,20-Apr-1993,,
A-A-30056E,"Cup, Specimen, (Sterile and Nonsterile)",31-Oct-1992,,Cancelled Date: 9-Mar-2001
PPP-B-575,"Box, Paper-Overlaid Veneer (Strap-Around Type)",20-Aug-1956,,
H-B-371F,"Brush, Artist's, Marking",16-Feb-1995,,Cancelled Date: 19-Jun-1961
H-B-711K,"Brushes, Varnish, Oval",6-Jul-1995,,Cancelled Date: 9-Apr-1999
A-A-3068/GEN,"Stones, Sharpening",14-Feb-1997,,Cancelled Date: 2-Apr-1998
A-A-2943,"Tag Board, Manila",4-Oct-1995,,Cancelled Date: 10-Nov-1999
A-A-2889,"Brush, Chassis and Running Gear",1-Feb-1995,,
A-A-2832,"Label, Paper, Pressure-Sensitive Adhesive",26-Jul-1995,,Cancelled Date: 2-Sep-1999
A-A-2299D,"Bag, Plastic, General Purpose (Containing Post Consumer Reco",9-Feb-1996,,Cancelled Date: 24-Nov-1999
A-A-2288B,"Calculator, Electronic (Handheld, Basic Scientific) (Battery",4-Feb-1997,,Cancelled Date: 9-Sep-1999
A-A-1742B,Plastic Sheet and Strip (for Use in Contact With Food),3-May-1995,,
A-A-689A,"Carton, Egg",2-Aug-1995,,Cancelled Date: 10-Nov-1999
A-A-356A,"Marker, Tube Type (White)",2-Oct-1995,,Cancelled Date: 30-Jul-1999
A-A-164B,"Cover, Bedding (Flame Resistant)",10-Nov-1992,,
A-A-94B,"Starch, Laundry",27-Jun-1996,,Cancelled Date: 30-Jan-1995
A-A-75A,"Combs, Hair (Plastic)",31-Mar-1993,,Cancelled Date: 8-Jan-1998
A-A-73A,"Hairbrush, Synthetic",1-Jun-1992,,Cancelled Date: 22-Dec-1999
A-A-51102,Ritodrine Hydrochloride Injection,26-Nov-1985,,Cancelled Date: 22-Dec-1999
LLL-M-71B,"Mallets and Mauls, Wood",19-Dec-1963,,
A-A-0051869,Halcinonide Solution,9-Mar-1987,,
A-A-50065B,"Insect Repellent, Personal Application Stick",24-Sep-1992,,Cancelled Date: 30-Oct-1998
A-A-51114,Valproate Sodium Syrup,26-Nov-1985,,Cancelled Date: 14-Dec-1998
A-A-51080,Vincristine Sulfate Injection,21-Nov-1985,,Cancelled Date: 4-Dec-1998
FED-STD-536/210.1,Sieve Tests,24-Apr-1961,,
FED-STD-101/203.1,"Acidity, Alkalinity, and Hydrogen Ion Concentration (Ph)",9-Mar-1964,,Cancelled Date: 15-Feb-1956
A-A-51739A,"Retractor, Universal, Delee",6-Jul-1988,,
A-A-0051732,"Niclosamide Tablets, Chewable",20-Oct-1986,,Cancelled Date: 27-Jul-1999
A-A-51418A,"Prednisolone Sodium Succinate, Sterile, Veterinary",16-Sep-1986,,Cancelled Date: 4-Dec-1998
A-A-51381A,"Magaldrate Oral Suspension, USP",11-Sep-1986,,Cancelled Date: 4-Dec-1998
GGG-M-350B,"Mirror, Inspection",16-Jul-1990,,
GGG-B-451D,"Blade, Hand Hacksaw and Blade, Power Hacksaw",31-Jan-1968,,Cancelled Date: 26-Oct-1998
FF-B-171/18(2),"Bearing, Ball, Annular, Single Row, Primarily Radial, Counte",30-Nov-1993,,Cancelled Date: 30-Jul-1999
GGG-A-145A,"Adjusting Tool, Brake Shoe (Spoon Type)",6-Aug-1965,,
GGG-F-671B(4),"Frame, Hand Hacksaw; Frame, Jeweler's Saw; and Frame, Coping",11-Jul-1957,,Cancelled Date: 1-Dec-1998
A-A-2364A,"Element, Typing (96 Characters)",6-Jan-1992,,
QPL-TT-C-530-3,"Coating Compound, Rust Inhibitive, Fish Oil Base",7-May-1968,,Cancelled Date: 30-Dec-1998
A-A-2016,"Box, Folding",17-Sep-1982,,Cancelled Date: 1-Oct-2001
A-A-52006B,"Plotter, Digital",30-Jun-2003,,
A-A-2022,"Box, Fiberboard, Overpack for Three Type IV Boxes for Post O",19-Oct-1982,,
A-A-3178,"Marker, Tube Type, Various",2-Dec-1998,,Cancelled Date: 25-Nov-1998
FED-STD-87,"Tables, Wood, General Office",20-Jul-1955,,Cancelled Date: 14-Apr-1999
LLL-T-431B,"Tile, Cork",22-Oct-1959,,Cancelled Date: 31-Aug-1967
CCC-C-00351A,"Cloth, Cotton, Ticking, Twill",20-Oct-1959,,
QQ-W-00426,"Wire, Steel, Corrosion (and Heat) Resisting Cold Heading and",14-Dec-1956,,Cancelled Date: 18-Apr-1994
UU-C-96K(1),"Card, Guide, File, Pressboard and Card Set, Guide, File, Pre",21-Aug-1963,,
UU-P-668E,"Plate, Lithographic Printing, Paper, (Direct Image and Photo",18-Mar-1964,,Cancelled Date: 3-May-1968
A-A-1592A,"Calculating Machine (Desk Top, 12 Digit Display/Print)",31-Jan-1983,,Cancelled Date: 23-Mar-1970
A-A-52569A,"Sink, Photographic Processing and Sink, Lithographic Process",3-May-2002,,
FED-STD-190,Terms Used for Classification of Chemicals and Chemical Prod,11-Jan-1962,,Cancelled Date: 14-Feb-2005
FED-STD-2,"Coal, Pennsylvania Anthracite",21-Nov-1950,,Cancelled Date: 25-May-1977
A-A-51526A,"Norethindrone and Mestranol Tablets, USP 63S",23-Jul-1987,,
A-A-51669,"Candler, Egg",19-Sep-1986,,
W-A-450/16,"Detector, Acoustic, Passive/Discriminator, Sonic",3-Jan-1992,,
W-A-450/1,"Components for Interior Alarms Systems, Balanced Magnetic Sw",28-Aug-1990,,Cancelled Date: 30-Dec-1998
GGG-W-653B,"Wrench, Ratchet, Reversible",12-Mar-1964,,
A-A-3161,"Primer Coating, Conditioner for Caulking Exterior Surfaces",11-May-1998,,Cancelled Date: 14-Jan-1999
A-A-20283,"Soup Mix, Vegetable, Dehydrated",8-Jan-1999,,
A-A-53122,"Methyldopa Tablets, USP",27-Jul-1987,,
A-A-53069,"Fluocinonide Cream, USP",20-Jul-1987,,Cancelled Date: 16-Oct-1998
A-A-51611,"Methylprednisolone Acetate Suspension, Sterile, USP",8-Jul-1987,,Cancelled Date: 16-Oct-1998
NNN-S-00100,"Scrapers, Laboratory, Rubber",5-Apr-1965,,Cancelled Date: 12-May-1993
QQ-A-250/22A,"Aluminum Alloy, 7178-T76, Plate and Sheet, Alclad (Improved",27-Jun-1974,,
QQ-A-250/25A,"Aluminum Alloy Alclad 7075, Plate and Sheet (Improved Exfoli",25-Jun-1974,,Cancelled Date: 25-May-2005
QQ-A-250/1F,"Aluminum 1100, Plate and Sheet",30-Jun-1983,,Cancelled Date: 25-May-2005
A-A-549E,"Cushioning Material, Packaging (Flexible Closed Cell Plastic",15-Oct-1998,,
TT-P-0053E(2),"Paint, Ready-Mixed, Outside, Medium-Chrome-Yellow",2-Jun-1972,,
DDD-P-58B,"Pad, Typewriter, Felt",12-Jun-1963,,Cancelled Date: 26-Nov-1976
A-A-3175,"Clipboard (Plastic, Recycled Plastic & Aluminum)",2-Oct-1998,,Cancelled Date: 16-Aug-1977
A-A-3172,Executive Type - Ballpoint Pens/Fountain Pens & Sets (Retrac,5-Oct-1998,,Cancelled Date: 19-Nov-1999
A-A-2099B,"Paper, Wrapping, Waxed",1-Oct-1998,,Cancelled Date: 18-Nov-1999
A-A-3104,"Apron, Laboratory",27-Jun-1997,,Cancelled Date: 6-Oct-1999
ZZ-T-91,"Tanks, Photographic, Hard-Rubber Developing and Fixing",2-Apr-1935,,
O-A-91(3),"Acid: Oxalic, Technical",8-Nov-1935,,Cancelled Date: 11-Aug-1964
TT-P-88A,"Paint, Resin-Base Emulsion, Interior, Paste, White and Tints",26-May-1945,,Cancelled Date: 24-May-1961
QQ-M-71,Manganese: Ore,3-May-1932,,Cancelled Date: 24-Mar-1965
TT-R-58(1),Radioactive-Luminous-Compound and Adhesives,9-Apr-1941,,
QQ-M-54,"Magnesuim Alloy (1.5 Manganese), Plate and Sheet",3-Sep-1948,,
UU-P-31,Paper General Specifications and Methods of Testing,3-Mar-1949,,Cancelled Date: 21-Feb-1962
PPP-P-16C(1),"Packaging of Photographic Dry and Liquid Chemicals, General",15-Jun-1967,,Cancelled Date: 2-Oct-1989
PPP-P-0015D(5),"Packaging and Packing of Storage Cabinets, Wardrobes and Clo",29-Jun-1970,,Cancelled Date: 15-Jan-1999
PPP-P-10,"Packing of Fiber Boxes, Liners and Sleeves, Knocked-Down, Fl",1-Sep-1965,,Cancelled Date: 5-Mar-1998
PPP-L-1607A,"Lagging, Wood, Wirebound",19-Jan-1971,,Cancelled Date: 9-Sep-1965
PPP-L-440A,"Liner Material, Greaseproof, (for Spirally-Wound Fiber Conta",11-Sep-1961,,Cancelled Date: 26-May-1998
PPP-G-2919,"Generator Sets, Mobile Electric Power and Supplemental Equip",25-Mar-1997,,Cancelled Date: 16-Apr-1971
PPP-G-460C(1),"Glass Containers, Filled and Closed, Packaging and Packing",8-Nov-1976,,Cancelled Date: 19-Mar-2001
PPP-F-690D,"Frozen Fruits, Frozen Fruit Juices, and Frozen Vegetables:",20-Nov-1981,,Cancelled Date: 2-Oct-1989
PPP-F-685B(3),"Fresh Fruits and Vegetables; Packaging, Packing, and Marking",1-May-1967,,Cancelled Date: 8-Jul-1999
PPP-E-911D,"Excelsior, Wood, Fabricated Pads and Bulk Form",28-Sep-1973,,Cancelled Date: 28-Jun-1991
PPP-D-001860,"Drums, Plastic, Molded Polyethylene",21-Nov-1975,,Cancelled Date: 21-May-1991
PPP-D-1427A,"Dunnage, Pneumatic, Cargo Shoring (Notice 1 dated 9/6/2001 t",29-Jan-1973,,Cancelled Date: 7-Oct-1993
PPP-D-1152B,"Drum Shipping: Steel, 55-Gallon (24 and 21 Gage Reinforced)",5-Oct-1972,,Cancelled Date: 6-Sep-2001
PPP-D-732D,"Drums, Metal, 55-Gallon Reconditioned (for Shipment of Nonco",14-Apr-1976,,Cancelled Date: 9-Aug-1988
PPP-D-715,"Drums, Fiber, With Recessed Ends",28-May-1958,,
PPP-D-711E,"Drum: Metal, Shipping, Steel, Light Weight (55 Gallon)",16-Dec-1975,,Cancelled Date: 1-Jun-1961
PPP-D-00650A,"Drawer, Small Parts Storage (Kit, Knocked-Down)",13-Oct-1967,,
PPP-C-1924,"Dunnage Material, Vermiculite and Perlite (for Packaging Pur",7-Jan-1975,,
PPP-C-1581A,"Cans, Composite, With Metal Ends, for Liquid Items",8-Oct-1971,,
PPP-C-1128A(1),"Container Assembly, Sample and Specimen Shipping",2-Nov-1972,,
PPP-C-650,"Crates, Wood, Open and Covered",2-Jan-1964,,
PPP-C-580,"Crates, Wood, Household Goods",22-Mar-1979,,Cancelled Date: 12-Sep-1978
PPP-C-55B,"Cans, Composite, for Dry Products",16-Apr-1975,,
PPP-C-29G,"Canned Subsistence Items, Packaging of",3-May-1989,,Cancelled Date: 26-May-1998
PPP-C-26B(1),"Canned Baked, Canned Steamed, and Canned Steamed and Retorte",20-Jan-1976,,Cancelled Date: 22-Mar-2000
PPP-C-0020B,"Packaging and Packing of Filing Cabinets, Steel, Card Size",1-Oct-1976,,Cancelled Date: 10-Aug-1992
PPP-B-2920,Boilers and Related Equipment; Packaging Of,25-Mar-1997,,Cancelled Date: 2-Oct-1989
PPP-B-2122,"Box, Folding (Paperboard, For Archival Microfiche)",1-Oct-1981,,Cancelled Date: 19-Mar-2001
PPP-B-1980,Boards; Bulletin and Control; Packaging and Packing of,18-Nov-1977,,Cancelled Date: 26-Oct-1994
PPP-B-1880,"Brushes, Preparation for Delivery of",16-Dec-1975,,Cancelled Date: 8-Jul-1999
PPP-B-001826,"Box, Shipping, Fiberboard (Highly Weather-Resistant)",21-Feb-1973,,Cancelled Date: 14-Mar-1995
PPP-B-1806,Barrels and Kegs: Wood Slack,28-Sep-1973,,Cancelled Date: 16-Feb-1977
PPP-B-1803,"Brushes, Artists, Markers, and Painters, Packaging and Packi",9-Feb-1973,,Cancelled Date: 9-Aug-1988
PPP-B-1729,"Brushes, Packaging and Packing of",11-Nov-1971,,Cancelled Date: 16-Dec-1975
PPP-B-1714,"Bags, Shipping: Woven Polypropylene",14-Aug-1973,,Cancelled Date: 16-Dec-1975
PPP-B-001608(1),"Box, Corrugated Fiberboard, Weather-Resistant, Coated",1-May-1970,,
PPP-B-1606A,"Box, Fiberboard Special Use (Post Office Money Order Forms)",8-Mar-1974,,Cancelled Date: 2-Feb-1977
TT-P-23,"Paint, Cold-Water, Interior, Light-Tints and White",22-Mar-1940,,Cancelled Date: 29-Sep-1995
TT-P-22,"Paint; Cold-Water Exterior, Powder (With Mixing Liquid)",30-Aug-1943,,Cancelled Date: 2-Aug-1951
TT-P-20,"Paint, Blue-Lead-Base; Basic-Sulfate, Linseed Oil, Ready-Mix",12-Jan-1940,,Cancelled Date: 30-Apr-1965
TT-P-18,"Paint, Alkyd Resin-Emulsion, Exterior, Paste, Tints and Whit",2-Jul-1947,,Cancelled Date: 26-Mar-1964
PPP-W-00100(4),"Wardrobes Steel, Packaging and Packing of",23-Aug-1965,,Cancelled Date: 10-Mar-1965
PPP-V-205C,"Veneer, Paper Overlaid, Container Grade",13-Oct-1969,,Cancelled Date: 30-Jun-1970
PPP-T-1637,"Tubes, Shipping, Collapsible",6-Aug-1971,,Cancelled Date: 3-Mar-1995
PPP-T-001471,"Tool Equipment Te-49, Packaging, Packing, and Marking of",10-Jun-1968,,Cancelled Date: 5-Jan-1996
PPP-T-001470,"Tool Equipment Te-73, Packaging, Packing, and Marking of",8-Jun-1968,,Cancelled Date: 7-Jul-1972
PPP-T-1002(1),"Tool Kit Te-87-A, Packaging and Packing of",10-Jun-1968,,Cancelled Date: 7-Jul-1972
PPP-T-1001,"Tool Set Te-51, Packaging and Packing of",10-Jun-1968,,Cancelled Date: 31-Jan-1978
PPP-T-360A(1),"Time Measuring Instruments, Packaging of",1-Aug-1962,,
PPP-T-0075,"Tape, Preservation and Sealing",13-Sep-1971,,Cancelled Date: 1-May-2000
PPP-S-1933A,"Sacks, Shipping, Paper (Utility)",6-Feb-1975,,Cancelled Date: 28-Feb-1980
PPP-S-1853,"Skids, Wood With Caps",10-Dec-1974,,Cancelled Date: 21-Jul-1978
PPP-S-50A,"Sacks, Shipping, Paper, Reinforced",29-Jul-1957,,Cancelled Date: 1-Jun-1990
PPP-P-2008,"Preparation for Delivery Requirements for Partitions, Office",12-Feb-1976,,Cancelled Date: 3-Nov-1973
PPP-P-1998,"Preparation for Delivery Requirements for Storage Sections,",29-Apr-1976,,Cancelled Date: 2-Oct-1989
PPP-P-001946,Packaging and Packing of Steel Credenza Furniture,28-Jun-1976,,Cancelled Date: 2-Oct-1989
PPP-P-001944,"Packaging and Packing of Lateral Filing Cabinets, Steel, Gen",9-Jun-1976,,Cancelled Date: 2-Oct-1989
PPP-P-001941,"Packaging and Packing of Carrels, Desk Top, Steel",17-Dec-1976,,Cancelled Date: 2-Oct-1989
PPP-P-001938,"Packaging and Packing of Office Partitions, Portable, Fabric",15-Oct-1976,,Cancelled Date: 2-Oct-1989
PPP-P-1937,"Preparation for Delivery Requirements for Desks, Steel, Flat",30-Nov-1976,,Cancelled Date: 2-Oct-1989
PPP-P-1899(1),"Preparation for Delivery Requirements for Tables, Steel, Gen",20-Dec-1974,,Cancelled Date: 2-Aug-1989
PPP-P-1892,"Paint, Varnish, Lacquer, and Related Materials; Packaging,",31-Dec-1974,,Cancelled Date: 5-Mar-1998
PPP-P-1882,"Preparation for Delivery Requirements for Templates, Triangl",26-Nov-1974,,Cancelled Date: 21-Nov-1997
PPP-P-1877A,Packaging and Packing of Wood Office Furniture,14-Oct-1977,,Cancelled Date: 2-Oct-1989
PPP-P-1875,"Preparation for Delivery Requirements for Chairs, Metal and",30-May-1975,,Cancelled Date: 2-Oct-1989
PPP-P-1660A,"Pallet, Expendable",12-Apr-1973,,Cancelled Date: 2-Oct-1989
PPP-P-1656,"Packing and Packaging, Fluorescent Light Fixtures",16-Dec-1974,,Cancelled Date: 1-May-2000
PPP-P-1655A,"Pail, Plastic, Shipping and Storage",24-Aug-1973,,Cancelled Date: 2-Oct-1989
PPP-P-1136D,Packaging of Coated (Plastic; Rubber) and Laminated Fabrics,30-Dec-1986,,
PPP-P-1132C,"Packaging of Woolen, Worsted and Wool Blend (Synthetic Fiber",31-Oct-1983,,Cancelled Date: 10-Apr-2002
PPP-P-620A(4),"Poultry, Chilled and Frozen, Ready to Cook (Eviscerated), Pa",4-Dec-1964,,
PPP-P-600G,"Porcelain Enamel Products and Household Appliances, Electric",31-Dec-1992,,Cancelled Date: 26-Feb-1971
PPP-P-420B(1),Plugs and Flanges (for Drum Closures),15-Aug-1972,,Cancelled Date: 8-Jul-1999
PPP-P-225C(2),"Preparation for Delivery Requirements for Desks, General Off",18-Dec-1974,,Cancelled Date: 12-Dec-1994
PPP-P-150B,"Paper, Shredded, Wax",7-Aug-1967,,Cancelled Date: 2-Oct-1989
PPP-P-130A(2),"Pails, Cans and Waste Receptacles, Packing of",14-Aug-1970,,Cancelled Date: 11-Jan-1972
PPP-P-115D,"Pads, Paper, Macerated",9-Jul-1973,,Cancelled Date: 14-Mar-1995
PPP-P-50A(1),Packaging and Packing of Thread for Domestic and Overseas Sh,6-Feb-1970,,Cancelled Date: 28-Jul-1998
PPP-P-45B,"Packing of Bulk Quantities of Soaps, Detergents and Related",1-Jul-1975,,Cancelled Date: 5-Apr-2000
PPP-P-40C,Preservation and Packing of Hand Tools; Tools and Tool Acces,25-May-1998,,Cancelled Date: 21-Dec-1979
PPP-P-0020,"Packaging and Packing of File Cabinets, Steel Card Size (Tab",1-Oct-1976,,
PPP-B-1163B(2),"Box, Corrugated Fiberboard, High Compression Strength, Weath",27-Feb-1970,,Cancelled Date: 26-Oct-1994
PPP-B-1122(2),"Balances, Scales, and Accessories, Packaging and Packing of",31-Oct-1968,,Cancelled Date: 26-May-1998
PPP-B-1117,"Bags, Sand (Civil Works and Flood Control): Biodegradable Te",5-Jan-1968,,Cancelled Date: 28-Jun-1988
PPP-B-1088C,"Bag, Textile (Cotton Drill)",9-Oct-1986,,Cancelled Date: 3-Jul-1972
PPP-B-670,"Box, Setup, Mailing, Dental",29-Sep-1959,,
PPP-B-655,"Boxes, Fiberboard, Six or Eight Sides",27-Jul-1959,,Cancelled Date: 22-Mar-1974
PPP-B-638B,"Boxes, Caps, Liners and Sleeves, Fiberboard, Knocked Down, F",30-Jun-1975,,Cancelled Date: 22-Mar-1974
PPP-B-621D(3),"Boxes, Wood, Nailed and Lock-Corner",21-Oct-1981,,Cancelled Date: 22-Mar-1995
PPP-B-26E(2),"Bag, Plastic, (General Purpose)",24-Feb-1975,,
PPP-A-1182B,"Aluminumware, Bakeshop and Kitchen, Packaging Packing, and",19-Dec-1974,,Cancelled Date: 22-Nov-1999
NNN-W-25B,"Wash Bottle, Laboratory",29-Jun-1976,,Cancelled Date: 1-Aug-1994
NNN-T-001529B,"Test Paper, Hydrogen Ion",22-Jun-1970,,Cancelled Date: 31-Jan-1996
NNN-T-001300,"Tube, Blood Collecting, Vacuum, Sterile",31-Oct-1969,,Cancelled Date: 26-Sep-1990
NNN-T-001293,"Tube, Blood Collecting, Vacuum, Nonsterile",4-Nov-1969,,Cancelled Date: 28-Aug-1978
NNN-T-792A,"Tube, Drying, Laboratory",29-Mar-1963,,Cancelled Date: 31-Dec-1992
NNN-T-785B,"Tube, Centrifuge (Plastic)",15-Jul-1969,,Cancelled Date: 6-Jun-1988
NNN-T-685A,"Triangle, Wire, Laboratory",25-Oct-1962,,Cancelled Date: 19-May-1993
NNN-T-360B,"Tissue Grinder, Tenbroeck",8-Dec-1976,,Cancelled Date: 1-Jul-1977
NNN-T-340A,"Tile, Pill (Pharmaceutical)",24-Jan-1963,,Cancelled Date: 19-May-1993
NNN-T-189B,"Test Tube, Laboratory, Glass",2-Jul-1976,,Cancelled Date: 28-Aug-1978
NNN-T-175A,"Test Tube, Comparison",24-Jan-1963,,Cancelled Date: 31-Jan-1996
NNN-T-170C,"Test Tube, Blood Sugar Determination",4-Mar-1970,,Cancelled Date: 28-Aug-1978
NNN-S-720,"Shaking Machine, Laboratory, Kahn; and Racks",8-Dec-1960,,Cancelled Date: 1-Jul-1977
NNN-S-636C,"Plate, Spot Test, White Porcelain",6-Aug-1975,,Cancelled Date: 12-May-1977
NNN-S-450B,"Slide, Microscope",27-Sep-1976,,Cancelled Date: 30-Nov-1990
JJJ-A-20,"Acacia, Technical (Gum Arabic)",24-Jan-1958,,Cancelled Date: 31-Jan-1996
NNN-C-001504,"Condensers, Laboratory",19-May-1970,,Cancelled Date: 27-Jan-1971
NNN-C-001495,"Cup, Reagent, Blood and Plasma Coagulation",2-Dec-1968,,Cancelled Date: 17-May-1977
NNN-C-1494A,"Cup, Blood Sample",27-Apr-1973,,Cancelled Date: 17-May-1977
NNN-C-1473A,"Cuvette, Spectrophotometer",11-Mar-1970,,Cancelled Date: 25-Mar-1988
NNN-C-688,"Crucible, Ignition, Laboratory; Metal",22-Oct-1962,,Cancelled Date: 1-Jul-1977
NNN-C-550,"Connector, Plastic, for Flexible Tubing",23-Jun-1961,,Cancelled Date: 22-Mar-1993
NNN-C-00545,"Connector, Elastic Tubing, Branched, Metal",11-Dec-1964,,Cancelled Date: 17-May-1977
NNN-C-440,"Clamps, Utility, Laboratory, and Holders, Buret and Clamp",1-Mar-1963,,Cancelled Date: 28-Aug-1978
NNN-C-20,"Can, Pipet Sterilizing",17-Mar-1965,,Cancelled Date: 28-Jan-1987
NNN-B-001636(1),"Burner, Alcohol, Dental",15-Apr-1970,,Cancelled Date: 13-Jan-1996
NNN-B-001618,"Bottle, Screw Cap, Narrow Mouth, Round",4-Feb-1970,,Cancelled Date: 28-Aug-1978
NNN-B-001522,"Bottle, Stopper (Narrow and Wide Mouth)",17-Mar-1978,,Cancelled Date: 28-Aug-1978
NNN-B-1505A,"Bottles, Screw Cap, Glass (Laboratory Use)",10-Sep-1976,,Cancelled Date: 26-Jan-1988
NNN-B-001493,"Bottle, Weighing (With Stopper)",14-Jul-1969,,Cancelled Date: 31-Jan-1996
NNN-B-1484A,"Bottle, Stopper, Wide Mouth",17-Mar-1970,,Cancelled Date: 17-May-1977
NNN-B-001291,"Basket, Test Tube",4-Mar-1970,,Cancelled Date: 20-Jul-1977
NNN-B-795,"Burner, Gas, Laboratory",1-Aug-1961,,Cancelled Date: 4-May-1988
NNN-B-788A,"Bulb, Dropping, Pipet",25-Oct-1962,,Cancelled Date: 1-Jul-1977
NNN-B-600,"Borer Set, Cork",15-Mar-1961,,Cancelled Date: 30-Nov-1990
NNN-B-590A,"Box, Microscope Slide, Wood",6-Feb-1964,,Cancelled Date: 28-Aug-1978
