Document Number,Document Title,Document Date,Cancelled/Superceding Document,Cancelled/Superceding Date
AA-F-1097A(1),"Files, Horizontal, Desk",1-Aug-1973,A-A-112,Superceding Date: 30-Jul-1986
AA-F-680B,"Frame, Picture (Wood)",22-Mar-1988,A-A-3005,Superceding Date: 31-Mar-1997
AA-F-367,"Filing Cabinet, Steel, Tabulating Machine Card Size",20-Aug-1956,71PartIIISecC,Superceding Date: 9-Jan-1989
AA-F-00359K,"Filing Cabinets, Steel, Legal and Letter Size, Vertical",28-Mar-1996,A-A-3186,Superceding Date: 22-Mar-2002
AA-F-359J,"Filing Cabinets, Steel, Legal and Letter Size Vertical",3-Nov-1993,A-A-3186,Superceding Date: 22-Mar-2002
AA-F-00355B,"Filing Cabinet, Steel, Legal and Letter Size, Insulated",10-Jan-1972,A-A-2196,Superceding Date: 31-Oct-1986
AA-F-355A,"Filing Cabinet, Steel, Legal and Letter Size, Insulated",21-Jun-1961,A-A-2196,Superceding Date: 31-Oct-1986
AA-E-35E,"Easel, Display and Training",8-May-1989,A-A-2866,Superceding Date: 1-Feb-1994
AA-D-001923,"Desk Attachments, 'L' Return Platform, Contemporary Style",3-Nov-1975,A-A-2093D,Superceding Date: 3-Dec-1993
AA-D-001918,"Desks, Flat Top, Steel, Contemporary Style",5-Sep-1975,A-A-2095D,Superceding Date: 3-Nov-1993
AA-D-170A,"Desk, Flat Top",20-Feb-1976,A-A-50897A,Superceding Date: 22-Nov-1989
AA-D-97(2),"Davenports, Executive Office",11-Jan-1951,AA-O-001091B,"Cancelled Date: 26-Jul-1977 Superceding Date: 26-Jul-1977"
AA-C-001919,"Credenzas, Steel, Contemporary Style",22-Oct-1975,A-A-2015A,"Cancelled Date: 12-Oct-1986 Superceding Date: 12-Oct-1986"
AA-C-001870,"Costumer, Metal, Contemporary Style",24-Jun-1974,A-A-2112,"Cancelled Date: 12-Oct-1986 Superceding Date: 12-Oct-1986"
AA-C-001779G,"Filing Cabinet, Steel, Lateral and Front To Back Filing, Leg",22-Apr-1996,A-A-3187,Superceding Date: 22-Mar-2002
AA-C-1779F,"Filing Cabinet, Steel, Lateral and Front to Back Filing, Leg",3-Nov-1993,A-A-3187,Superceding Date: 22-Mar-2002
AA-C-001771C,"Chairs, Double Shell, Molded Plastic, Rotary, Upholstered",23-Jul-1979,A-A-700B,Superceding Date: 7-Jun-1994
AA-C-001770A,"Cabinets, Wardrobe and Storage, Contemporary Style, Steel, G",31-Mar-1978,A-A-2113,Superceding Date: 3-Dec-1993
AA-C-001228,"Chairs, Straight, Without Arms, Tubular Steel, Stacking",5-Dec-1969,AA-C-001868,Superceding Date: 26-Mar-1975
AA-C-00556E,"Costumer, Wood, General Office",1-Jul-1993,A-A-3136,Superceding Date: 26-Mar-1998
AA-C-556B,"Costumer, Wood, General Office",26-May-1952,A-A-3136,Superceding Date: 26-Mar-1998
AA-C-00295A(2),"Chairs, Rotary, Steel, Tubular, Special Purpose",11-Feb-1963,A-A-3113,Superceding Date: 14-Jan-1997
AA-C-295,"Chairs, Rotary, Steel Tubular, Special Purpose",5-Aug-1955,A-A-3113,Superceding Date: 14-Jan-1997
AA-C-291G,"Chairs, Folding, (Steel)",8-Feb-1989,A-A-3083,Superceding Date: 26-Apr-2000
AA-C-35(2),"Cabinet, Telephone, Wood, Executive Office Type",7-Sep-1950,AA-O-230/2,Superceding Date: 7-Oct-1964
AA-C-33B,"Cabinets, Small Parts, Storage",19-Jun-1963,71PartIIISecC,Superceding Date: 3-Dec-1993
AA-C-30D,"Cabinet, Key, (Boxes and Racks, Metal, and Identification Sy",21-Jul-1960,A-A-2547,Superceding Date: 20-Jan-1988
W-F-1726/17,"Fuse, Cartridge, Class H, Renewable, 250 Volts, 201-400 Ampe",11-Jun-1973,W-F-1814/60,Superceding Date: 19-Nov-1986
W-F-1726/10,"Fuse, Cartridge, Class H, Nonrenewable, 600 Volts, 101-200 A",11-Jun-1973,W-F-1814/65,Superceding Date: 19-Nov-1986
W-F-1726/9(1),"Fuse, Cartridge, Class H, Nonrenewable, 600 Volts, 61-100 Am",11-Jun-1973,W-F-1814/64,"Cancelled Date: 19-Nov-1986 Superceding Date: 19-Nov-1986"
W-F-1726/8(1),"Fuse, Cartridge, Class H, Nonrenewable, 600 Volts, 31-60 Amp",11-Jun-1973,W-F-1814/63,"Cancelled Date: 19-Nov-1986 Superceding Date: 19-Nov-1986"
Z-P-354A,"Pineapple, Frozen",21-May-1958,Z-F-1743/12,Superceding Date: 10-Dec-1973
Z-P-351D(1),Pineapple; Canned,1-Apr-1958,Z-F-1742/23,Superceding Date: 25-May-1973
Z-P-201E,"Pears, Canned",13-Aug-1965,Z-F-1742/22,Superceding Date: 25-May-1973
Z-P-194A,"Peaches, Frozen",20-May-1952,Z-F-1743/11,Superceding Date: 10-Dec-1973
Z-P-191C,"Peaches, Canned",25-Jul-1958,Z-F-1742/21,Superceding Date: 25-May-1973
Z-O-670(1),"Orange-Juice, Concentrated; Canned",25-Jul-1955,Z-F-1742/18,Superceding Date: 25-May-1973
Z-M-106C,Marmalade; Orange,14-Dec-1970,Z-F-1742/20,Superceding Date: 25-May-1973
Z-L-351A,Lime-Juice; Frozen,21-Sep-1953,Z-J-1612,Superceding Date: 13-Jan-1971
Z-L-199A(2),"Lemonade, Concentrated For; Frozen",7-Jun-1954,Z-F-1743/10,Superceding Date: 10-Dec-1973
Z-J-1843,"Juice, Lemon, Reconstituted, Packet, Individual",10-Apr-1974,A-A-20144,"Cancelled Date: 19-Jun-1987 Superceding Date: 19-Jun-1987"
Z-J-1398A(2),"Juice, Orange, Frozen, Concentrated",7-May-1968,Z-F-1743/9,Superceding Date: 10-Dec-1973
Z-J-00895A(1),"Juice, Lemon, Canned",28-Jul-1964,Z-F-1742/16,Superceding Date: 25-May-1973
Z-J-875A,"Juice, Orange, Canned",7-Mar-1963,Z-F-1742/17,Superceding Date: 25-May-1973
Z-J-874A,"Juice, Grapefruit and Orange, Frozen, Concentrated",6-Jun-1963,Z-F-1743/7,Superceding Date: 10-Dec-1973
Z-J-00830,"Juice, Grapefruit and Pineapple, Canned; Blended",2-Mar-1966,Z-F-1742/15,Superceding Date: 25-May-1973
Z-J-825A,"Juice, Grapefruit, Frozen, Concentrated",24-Jan-1969,Z-F-1743/6,Superceding Date: 10-Dec-1973
Z-J-820A,"Juice, Grapefruit, Canned",7-Mar-1963,Z-F-1742/14,Superceding Date: 25-May-1973
Z-J-815,"Juice, Grape, Frozen, Concentrated",2-Nov-1959,Z-F-1743/5,Superceding Date: 10-Dec-1973
Z-G-691A(1),"Grapefruit and Orange Juice, Canned (Blended)",26-Oct-1950,Z-F-1742/13,Superceding Date: 25-May-1973
Z-G-678,"Grapefruit, Frozen",7-May-1954,Z-F-1743/4,Superceding Date: 10-Dec-1973
Z-G-676D(1),"Grapefruit, Canned",20-Dec-1960,Z-F-1742/10,Superceding Date: 25-May-1973
Z-G-661B(1),"Grape Juice, Single Strength; Canned",23-Nov-1951,Z-F-1742/12,Superceding Date: 25-May-1973
Z-F-681A(1),Fruit-Cocktail; Canned,18-Dec-1953,Z-F-1742/9,Superceding Date: 25-May-1973
Z-F-351D(1),"Figs, Canned",23-Oct-1958,Z-F-1742/8,Superceding Date: 25-May-1973
Z-C-1845,"Crab Apples, Spiced, Canned",12-Mar-1974,A-A-1845A,Superceding Date: 22-Jul-1988
Z-C-1651(1),"Cranberry Juice, Cocktail",6-Jul-1971,A-A-20121,Superceding Date: 21-May-1986
Z-C-851D,"Currants, Dried",28-Mar-1963,Z-R-71,Superceding Date: 9-Jun-1978
Z-C-656B,"Cranberry Sauce, Canned",12-Aug-1970,Z-F-1742/7,Superceding Date: 25-May-1973
Z-C-571H,"Coconut, Dried, Prepared",10-Jan-1979,A-A-20174,Superceding Date: 22-Jun-1990
Z-C-315B,"Cherries, Frozen",30-Nov-1959,Z-F-1743/3,Superceding Date: 10-Dec-1973
Z-C-301D,"Cherries, Canned",7-Sep-1961,Z-F-1742/6,Superceding Date: 25-May-1973
Z-B-491D,"Blueberries, Canned",2-Aug-1963,Z-B-421,Superceding Date: 10-Aug-1971
Z-B-421E,"Berries, Canned",10-Aug-1971,Z-F-1742/5,Superceding Date: 25-May-1973
Z-B-211A,"Berries, Frozen",20-May-1952,Z-F-1743/2,Superceding Date: 10-Dec-1973
Z-A-631C(2),"Apricots, Canned",12-Aug-1958,Z-F-1742/4,Superceding Date: 25-May-1973
Z-A-623(2),"Apple Juice, Single Strength, Canned",1-Feb-1952,Z-F-1742/11,Superceding Date: 25-May-1973
Z-A-621B(1),"Applesauce, Canned",10-Jul-1951,Z-F-1742/3,Superceding Date: 25-May-1973
Z-A-616E,Apple Butter,16-Jul-1970,Z-F-1742/2,Superceding Date: 25-May-1973
Z-A-615A,"Apples, Frozen",5-Sep-1957,Z-F-1743/1,Superceding Date: 10-Dec-1973
Z-A-611E(2),"Apples, Canned",15-Nov-1967,Z-F-1742/1,Superceding Date: 25-May-1973
W-L-314/5,"Light, Household, Tall Table, Type XVI",6-May-1980,UL 153,"Cancelled Date: 9-Mar-1987 Superceding Date: 9-Mar-1987"
W-L-314/4,"Light, Household, Large Table, Type XV",6-May-1980,UL 153,"Cancelled Date: 9-Mar-1987 Superceding Date: 9-Mar-1987"
W-L-314/2,"Light, Household, Dressing Table, Type IX",6-May-1980,UL-153,Superceding Date: 9-Mar-1987
W-L-314/1,"Light, Household Dresser, Type VIII",6-May-1980,UL-153,Superceding Date: 9-Mar-1987
W-L-00311B(2),"Light, Desk, Incandescent, Flexible Column",1-Mar-1969,A-A-2923,Superceding Date: 7-Sep-1995
W-L-311A(2),"Light, Desk, Incandescent, Flexible Column",14-Jan-1959,A-A-2923,Superceding Date: 7-Sep-1995
W-L-00310B(4),"Light, Desk (Fluorescent Pedestal)",4-Nov-1977,A-A-2130,Superceding Date: 13-Nov-1995
W-L-310A(2),"Light; Desk, Fluorescent, Pedestal",14-Nov-1955,A-A-2130,Superceding Date: 13-Nov-1995
W-L-305D,"Light Set, General Illumination (Emergency or Auxiliary)",12-May-1976,A-A-2001,Superceding Date: 11-Dec-1995
W-L-210A,"Lantern, Electric, Heavy Duty, (Rechargeable Battery)",13-May-1975,A-A-1382,Superceding Date: 21-Jun-1990
W-L-142A(2),"Lampholder, Adapter, and Shadeholder, Medium Screw Shell, 12",7-Mar-1960,UL-496,Superceding Date: 18-Aug-1995
W-L-00116/54,"Lamp, Fluorescent Trade No. F96T12/D, Instant Start, 60 Watt",13-Sep-1978,A-A-55004,"Cancelled Date: 19-Jul-1990 Superceding Date: 19-Jul-1990"
W-L-00116/53,"Lamp, Fluorescent Trade No. F96T12/Ww, Instant Start, 60 Wat",13-Sep-1978,A-A-55004,"Cancelled Date: 19-Jul-1990 Superceding Date: 19-Jul-1990"
W-L-00116/52,"Lamp, Fluorescent Trade No. F96T12/W, Instant Start, 60 Watt",13-Sep-1978,A-A-55004,"Cancelled Date: 19-Jul-1990 Superceding Date: 19-Jul-1990"
W-L-00116/51,"Lamp, Fluorescent Trade No. F96T12/Cw, Instant Start, 60 Wat",13-Sep-1977,A-A-55003,"Cancelled Date: 19-Jul-1990 Superceding Date: 19-Jul-1990"
W-L-00116/45A,"Lamp Fluorescent Trade No. F96T12/Ww, Instant Start, 75 Watt",27-May-1976,A-A-55004,"Cancelled Date: 19-Jul-1990 Superceding Date: 19-Jul-1990"
W-L-00116/44A,"Lamp Fluorescent Trade No. F96T12/W, Instant Start, 75 Watt,",27-May-1976,A-A-55004,"Cancelled Date: 19-Jul-1990 Superceding Date: 19-Jul-1990"
W-L-00116/43A,"Lamp Fluorescent Trade No. F96T12/Cw, Instant Start, 75 Watt",27-May-1976,A-A-55004,"Cancelled Date: 19-Jul-1990 Superceding Date: 19-Jul-1990"
W-L-00116/31A,"Lamp Fluorescent Trade No. F40D, Rapid Start, 40 Watt, T-12",27-May-1976,A-A-55002,"Cancelled Date: 19-Jul-1990 Superceding Date: 19-Jul-1990"
W-L-00116/30A,"Lamp Fluorescent Trade No. F40Ww, Rapid Start, 40 Watt, T-12",27-May-1976,A-A-55002,"Cancelled Date: 19-Jul-1990 Superceding Date: 19-Jul-1990"
W-L-00116/28A,"Lamp Fluorescent Trade No. F40Cw, Rapid Start, 40 Watt, T-12",27-May-1976,A-A-55002,"Cancelled Date: 19-Jul-1990 Superceding Date: 19-Jul-1990"
W-L-00116/16A,"Lamp Fluorescent Trade No. F20T12/Cw, Preheat, 20 Watt, T-12",26-May-1976,A-A-55005,Superceding Date: 19-Jul-1990
W-L-00111D/GEN,"Lamps, Incandescent, (Electric, Miniature and Subminiature,",21-Apr-1975,MIL-STD-15536,Superceding Date: 15-Mar-1991
W-L-00111/23,"Lamp, Incandescent, Miniature Trade No. 81, G-6 Clear Bulb,",21-Apr-1975,SAE-J543,Superceding Date: 5-Oct-1990
W-L-00111/16A,"Lamp, Incandescent, Sub Miniature Trade No. 6832, T-1 Clear",15-Sep-1977,ANSI-SR25C,"Cancelled Date: 15-Sep-1990 Superceding Date: 15-Sep-1990"
W-L-00111/15,"Lamp, Incandescent, Sub-Miniature Trade No. 6802, T-1 Clear",21-Apr-1975,ANSI-SR25C,"Cancelled Date: 15-Sep-1990 Superceding Date: 15-Sep-1990"
W-L-00111/14,"Lamp, Incandescent, Miniature Trade No. 1683, S-8 Clear Bulb",21-Apr-1975,ANSI-SR25C,"Cancelled Date: 15-Sep-1990 Superceding Date: 15-Sep-1990"
W-L-00111/13,"Lamp, Incandescent, Miniature Trade No. 307, S-8 Clear Bulb,",21-Apr-1975,ANSI-SR25C,"Cancelled Date: 15-Sep-1990 Superceding Date: 15-Sep-1990"
W-L-00111/12,"Lamp, Incandescent, Miniature Trade No. 3'5, S-8 Clear Bulb,",21-Apr-1975,ANSI-SR25C,"Cancelled Date: 15-Sep-1990 Superceding Date: 15-Sep-1990"
W-L-00111/11,"Lamp, Incandescent, Miniature Trade No. 222, Focused, Miniat",21-Apr-1975,ANSI-SR25C,"Cancelled Date: 15-Sep-1990 Superceding Date: 15-Sep-1990"
W-L-00111/10,"Lamp, Incandescent, Subminiature Trade No. 323, T-1 1/4 Clea",21-Apr-1975,ANSI-SR25C,"Cancelled Date: 15-Sep-1990 Superceding Date: 15-Sep-1990"
W-L-00111/9,"Lamp, Incandescent, Miniature Trade No. 313R, T-3 1/4 Clear",21-Apr-1975,ANSI-SR25C,"Cancelled Date: 15-Sep-1990 Superceding Date: 15-Sep-1990"
W-L-00111/8,"Lamp, Incandescent, Miniature Trade No. 313, T-3 1/4 Clear B",21-Apr-1975,ANSI-SR25C,"Cancelled Date: 15-Sep-1990 Superceding Date: 15-Sep-1990"
W-L-00111/7,"Lamp, Incandescent, Sub-Miniature Trade No. 387, T-1 3/4 Cle",21-Apr-1975,ANSI-SR25C,"Cancelled Date: 15-Sep-1990 Superceding Date: 15-Sep-1990"
W-L-00111/5,"Lamp, Incandescent, Sub-Miniature Trade No. 330, T-1 3/4 Cle",21-Apr-1975,ANSI-SR25C,"Cancelled Date: 15-Sep-1990 Superceding Date: 15-Sep-1990"
W-L-00111/4,"Lamp, Incandescent, Sub-Miniature Trade No. 328R, T-1 3/4 Cl",21-Apr-1975,ANSI-SR25C,"Cancelled Date: 15-Sep-1990 Superceding Date: 15-Sep-1990"
W-L-00111/3,"Lamp, Incandescent, Sub-Miniature Trade No. 328, T-1 3/4 Cle",21-Apr-1975,ANSI-SR25C,"Cancelled Date: 15-Sep-1990 Superceding Date: 15-Sep-1990"
W-L-00111/2,"Lamp, Incandescent, Sub-Miniature Trade No. 327R, T-1 3/4 Cl",21-Apr-1975,ANSI-SR25C,"Cancelled Date: 15-Sep-1990 Superceding Date: 15-Sep-1990"
W-L-68A,"Lamp, Incandescent, (Sealed Reflector, Aviation, Par 64 Bulb",3-Nov-1959,MIL-STD-25242,Superceding Date: 30-May-1989
W-L-65A(1),"Lamp, Incandescent, (Sealed Reflector, Aviation, Par56 Bulb,",3-Nov-1959,MIL-STD-24348,Superceding Date: 30-May-1989
W-L-62A(1),"Lamp, Incandescent, (Sealed Reflector, Aviation, Par46 Bulb,",3-Nov-1959,MIL-L-6363,Superceding Date: 30-May-1989
W-L-53A,"Lamp, Incandescent, (Sealed Reflector, Automotive, Military",3-Nov-1959,MIL-STD-25243,Superceding Date: 30-May-1989
W-J-800F,"Junction Box: Extension, Junction Box; Cover, Junction Box(",24-Jul-1992,A-A-59214,Superceding Date: 18-May-1998
W-H-636G,"Hotplates, Electric",20-Mar-1988,A-A-52132,Superceding Date: 22-Jun-1994
W-H-205C,"Heating Elements, Electrical (Replacements for Domestic Appl",24-May-1985,A-A-50495,Superceding Date: 10-May-1990
W-H-196J,"Heater, Water, Electric, and Gas Fired, Residential",14-Dec-1973,A-A-2955,Superceding Date: 27-Nov-1995
W-H-193D,"Heater, Space, Electric (Portable)",13-Sep-1977,UL-1042,Superceding Date: 22-Aug-1995
W-F-2793,"Fans, Centrifugal",2-Jul-1992,A-A-59222,Superceding Date: 18-May-1998
W-F-2190/11,"Filter, Radio Frequency Interference",13-Dec-1983,A-A-55171A,Superceding Date: 9-Apr-1993
W-F-2190/10,"Filter, Radio Frequency Interference",13-Dec-1983,A-A-55170A,Superceding Date: 9-Apr-1993
W-F-1726/16,"Fuse, Cartridge, Class H, Renewable, 250 Volts, 101-200 Ampe",11-Jun-1973,W-F-1814/59,Superceding Date: 19-Nov-1986
W-F-1726/15,"Fuse, Cartridge, Class H, Renewable, 250 Volts, 61-100 Amper",11-Jun-1973,W-F-1814/58,Superceding Date: 19-Nov-1986
W-F-1726/14,"Fuse, Cartridge, Class H, Renewable, 250 Volts, 31-60 Ampere",11-Jun-1973,W-F-1814/57,Superceding Date: 19-Nov-1986
W-F-1726/13,"Fuse, Cartridge, Class H, Renewable, 250 Volts, 0-30 Amperes",11-Jun-1973,W-F-1814/56,Superceding Date: 19-Nov-1986
W-F-1726/12,"Fuse, Cartridge, Class H, Nonrenewable, 600 Volts, 401-600 A",11-Jun-1973,W-F-1814/67A,Superceding Date: 19-Nov-1986
W-F-1726/11(1),"Fuse, Cartridge, Class H, Nonrenewable, 600 Volts, 301-400 A",11-Jun-1973,W-F-1814/66,Superceding Date: 19-Nov-1986
Y-W-121D,"Watermelons, Fresh",18-Sep-1962,HHH-V-1744/39,Superceding Date: 19-Oct-1973
Y-T-98B,"Tangerines, Fresh (Florida)",23-Jan-1963,Y-F-1741/20,Superceding Date: 12-Apr-1974
Y-T-96D,"Tangerines, Fresh",23-Jan-1963,Y-F-1741/20,Superceding Date: 12-Apr-1974
Y-R-101B,"Raspberries, Fresh",14-Mar-1957,Y-F-1741/18,Superceding Date: 12-Apr-1974
Y-P-506E,"Plums and Prunes, Fresh",22-Sep-1969,Y-F-1741/17,Superceding Date: 12-Apr-1974
Y-P-381E(2),"Pineapples, Fresh",31-Oct-1967,Y-F-1741/16,Superceding Date: 12-Apr-1974
Y-P-169B,"Pears, Fresh, Winter",8-Mar-1957,Y-F-1741/15,Superceding Date: 12-Apr-1974
Y-P-167B,"Pears, Fresh, Summer and Fall",8-Mar-1957,Y-F-1741/15,Superceding Date: 12-Apr-1974
Y-P-151F,"Peaches, Fresh",6-Sep-1968,Y-F-1741/14,Superceding Date: 12-Apr-1974
Y-O-663D(2),"Oranges, Fresh, (Florida",25-Sep-1967,Y-F-1741/13,Superceding Date: 12-Apr-1974
Y-O-662G(2),"Oranges, Fresh (Texas and States Other Than Florida, Califor",11-Oct-1967,Y-F-1741/13,Superceding Date: 12-Apr-1974
Y-O-660E,"Oranges, Fresh (California and Arizona)",25-Mar-1966,Y-F-1741/13,Superceding Date: 12-Apr-1974
Y-N-725E,"Nuts, Shelled, Roasted, Salted",18-May-1977,A-A-20164,Superceding Date: 22-Jul-1988
Y-M-212B,"Melons, Casaba and Persian Types; Fresh",11-Jan-1965,HHH-V-1744/20,Superceding Date: 19-Oct-1973
Y-L-369B(3),"Limes, Fresh, Persian (Tahiti)",24-Mar-1958,Y-F-1741/11,Superceding Date: 12-Apr-1974
Y-L-231C(2),"Lemons, Fresh",3-May-1960,Y-F-1741/10,Superceding Date: 12-Apr-1974
Y-H-495A,"Honeydew Melons, Fresh and Honeyball Melons, Fresh",25-Oct-1961,HHH-V-1744/20,Superceding Date: 19-Oct-1973
Y-G-683B(2),"Grapefruit, Fresh (Florida)",8-Apr-1963,Y-F-1741/8,Superceding Date: 12-Apr-1974
Y-G-682E,"Grapefruit, Fresh (Texas and States Other Than Florida, Cali",26-Jul-1968,Y-F-1741/8,Superceding Date: 12-Apr-1974
Y-G-680C(2),"Grapefruit, Fresh, (California and Arizona)",8-Apr-1963,Y-F-1741/8,Superceding Date: 12-Apr-1974
Y-G-671F(2),"Grapes, Fresh",24-Oct-1966,Y-F-1741/9,Superceding Date: 12-Apr-1974
Y-F-1741/15A,"Pears, Fresh",12-Apr-1974,AMS 07CFR51,"Cancelled Date: 14-Mar-1983 Superceding Date: 1-Jan-1983"
Y-F-1741/12A,"Nectarines, Fresh",12-Apr-1974,AMS 07CFR51,"Cancelled Date: 14-Mar-1983 Superceding Date: 14-Mar-1983"
Y-F-1741/3A,"Avocados, Fresh",12-Apr-1974,AMS 07CFR51,"Cancelled Date: 14-Mar-1983 Superceding Date: 14-Mar-1983"
Y-F-1741/2A,"Apricots, Fresh",12-Apr-1974,AMS 07CFR51,"Cancelled Date: 14-Mar-1983 Superceding Date: 14-Mar-1983"
Y-C-2083,"Cherries, Maraschino, Pitted, Red",16-Nov-1978,A-A-20131,Superceding Date: 21-May-1986
Y-C-651E(2),"Cranberries, Fresh",25-Sep-1967,Y-F-1741/7,Superceding Date: 12-Apr-1974
Y-C-306D(2),"Cherries, Fresh (Sweet)",31-Oct-1967,Y-F-1741/6,Superceding Date: 12-Apr-1974
Y-C-96D,"Cantaloupes, Fresh",15-Aug-1962,HHH-V-1744/9,Superceding Date: 19-Oct-1973
Y-B-496B,Blueberries; Fresh,22-Jul-1958,Y-F-1741/5,Superceding Date: 12-Apr-1974
Y-B-426B,"Blackberries, Boysenberries, Dewberries, Loganberries, and",6-Oct-1960,Y-F-1741/4,Superceding Date: 12-Apr-1974
Y-A-830C,"Avocados, Fresh",27-May-1968,Y-F-1741/3,Superceding Date: 12-Apr-1974
Y-A-621E(2),"Apricots, Fresh",25-Sep-1967,Y-F-1741/2,Superceding Date: 12-Apr-1974
Y-A-606F,"Apples, Fresh",13-Oct-1966,Y-F-1741/1,Superceding Date: 12-Apr-1974
W-T-741A,"Tubes, Electron, General Service",28-Mar-1955,MILSTD 311,Superceding Date: 3-Oct-1969
W-T-0061B(1),"Tapes, Sound Recording, Magnetic Oxide Coated, and Reels, So",21-Mar-1960,W-T-0070,Superceding Date: 10-Jun-1963
W-S-755C,"Starter, Fluorescent Lamp",19-Jul-1966,ANSI-C78.180,"Cancelled Date: 24-May-1983 Superceding Date: 15-Apr-1995"
W-S-610E,Splice Connectors,5-Jul-1990,A-A-59213,Superceding Date: 18-May-1998
W-S-570B(1),"Soldering Iron, Electric",30-Jun-1989,A-A-59284,Superceding Date: 18-Nov-1999
W-R-550A(1),"Rod, Ground (With Attachments)",12-Jun-1975,A-A-55804,Superceding Date: 11-Mar-1997
W-R-36D,"Raceways and Fittings, Metallic, Underfloor",25-Nov-1983,UL-884,Superceding Date: 23-Jan-1986
W-R-32B,Raceways and Fittings; Metallic Surface,12-Mar-1957,W-C-582,Superceding Date: 7-Jul-1964
W-P-455A(6),"Plate, Wall, Electrical",9-Sep-1964,UL 514,"Cancelled Date: 21-Sep-1984 Superceding Date: 21-Sep-1984"
W-O-830B,"Oven, Thermal Drying, Electric",6-Mar-1964,MIL-0-83990,Superceding Date: 25-Nov-1974
W-L-331,"Lighting Fixtures, Direct, Industrial (for Hot-Cathode Fluor",11-Jul-1950,W-F-1234,Superceding Date: 2-Oct-1973
W-L-314B/GEN,"Lights, Household",6-May-1980,UL-153,Superceding Date: 9-Mar-1987
W-L-314/10,"Light, Household, Small Table, Swing Arm (Study), Type XXI",6-May-1980,UL 153,Superceding Date: 9-Mar-1987
W-L-314/9,"Light, Household, Small Table, (Study) Type XX",6-May-1980,UL 153,Superceding Date: 9-Mar-1987
W-L-314/8,"Light, Household, Swing Arm Floor, Type XIX",6-May-1980,UL 153,"Cancelled Date: 9-Mar-1987 Superceding Date: 9-Mar-1987"
W-L-314/6,"Light, Household, Extra Tall Table, Type XVII",6-May-1980,UL 153,Superceding Date: 9-Mar-1987
W-F-2190/9,"Filter, Radio Frequency Interference",13-Dec-1983,A-A-55169A,Superceding Date: 9-Apr-1993
W-F-2190/7,"Filter, Radio Frequency Interference",13-Dec-1983,A-A-55167A,Superceding Date: 9-Apr-1993
W-F-2190/6,"Filter, Radio Frequency Interference",13-Dec-1983,A-A-55166A,Superceding Date: 9-Apr-1993
W-F-2190/3,"Filter, Radio Frequency Interference",13-Dec-1983,A-A-55163A,Superceding Date: 9-Apr-1993
W-F-2190/1,"Filter, Radio Frequency Interference",13-Dec-1983,A-A-55161A,Superceding Date: 9-Apr-1993
W-F-1814/46,"Fuse, Cartridge, High Interrupting Capacity, Class K1 (",23-May-1974,W-F-1814/67A,"Cancelled Date: 15-Jul-1985 Superceding Date: 15-Jul-1985"
W-F-1814/45,"Fuse, Cartridge, High Interrupting Capacity, Class K1 (",23-May-1974,W-F-1814/66,"Cancelled Date: 15-Jul-1985 Superceding Date: 15-Jul-1985"
W-F-1814/44,"Fuse, Cartridge, High Interrupting Capacity, Class, K1 (",23-May-1974,W-F-1814/65,Superceding Date: 15-Jul-1985
W-F-1814/43,"Fuse, Cartridge, High Interrupting Capacity, Class K1 (Noncu",23-May-1974,W-F-1814/64,"Cancelled Date: 15-Jul-1985 Superceding Date: 15-Jul-1985"
W-F-1814/42,"Fuse, Cartridge, High Interrupting Capacity, Class K1 (",23-May-1974,W-F-1814/63,"Cancelled Date: 15-Jul-1985 Superceding Date: 15-Jul-1985"
W-F-1814/41,"Fuse, Cartridge, High Interrupting Capacity, Class K1 (",23-May-1974,W-F-1814/62,Superceding Date: 15-Jul-1985
W-F-1814/40,"Fuse, Cartridge, High Interrupting Capacity, Class K1 (",23-May-1974,W-F-1814/61,Superceding Date: 15-Jul-1985
W-F-1814/39,"Fuse, Cartridge, High Interrupting Capacity, Class K1 (",23-May-1974,W-F-1814/60A,"Cancelled Date: 15-Jul-1985 Superceding Date: 15-Jul-1985"
W-F-1814/38,"Fuse, Cartridge, High Interrupting Capacity, Class K1 (",23-May-1974,W-F-1814/59,"Cancelled Date: 14-Jul-1985 Superceding Date: 15-Jul-1985"
W-F-1814/37,"Fuse, Cartridge, High Interrupting Capacity, Class K1 (",23-May-1974,W-F-1814/58,Superceding Date: 15-Jul-1985
W-F-1814/36,"Fuse, Cartridge, High Interrupting Capacity, Class K1 (",23-May-1974,W-F-1814/57,"Cancelled Date: 15-Jul-1985 Superceding Date: 15-Jul-1985"
W-F-1814/35,"Fuse, Cartridge, High Interrupting Capacity, Class K1 (",23-May-1974,W-F-1814/56,"Cancelled Date: 15-Jul-1985 Superceding Date: 15-Jul-1985"
W-F-1814/34,"Fuse, Cartridge, High Interrupting Capacity, Class K5 (",23-May-1974,W-F-1814/67,Superceding Date: 15-Jul-1985
W-F-1814/33,"Fuse, Cartridge, High Interrupting Capacity, Class K5 (Noncu",23-May-1974,W-F-1814/66,Superceding Date: 15-Jul-1985
W-F-1814/32,"Fuse, Cartridge, High Interrupting Capacity, Class K5 (",23-May-1974,W-F-1814/65,"Cancelled Date: 15-Jul-1985 Superceding Date: 15-Jul-1985"
W-F-1814/31,"Fuse, Cartridge, High Interrupting Capacity, Class K5 (",23-May-1974,W-F-1814/64,Superceding Date: 15-Jul-1985
W-F-1814/30,"Fuse, Cartridge, High Interrupting Capacity, Class K5 (Noncu",23-May-1974,W-F-1814/63,Superceding Date: 15-Jul-1985
W-F-1814/29,"Fuse, Cartridge, High Interrupting Capacity, Class K5 (",23-May-1974,W-F-1814/62,Superceding Date: 15-Jul-1985
W-F-1814/28,"Fuse, Cartridge, High Interrupting Capacity, Class K5 (",23-May-1974,W-F-1814/61,Superceding Date: 15-Jul-1985
W-F-1814/27,"Fuse, Cartridge, High Interrupting Capacity, Class K5 (",23-May-1974,W-F-1814/60,Superceding Date: 15-Jul-1985
W-F-1814/26,"Fuse, Cartridge, High Interrupting Capacity, Class K5 (",23-May-1974,W-F-1814/59,Superceding Date: 15-Jul-1985
W-F-1814/25,"Fuse, Cartridge, High Interrupting Capacity, Class K5 (Noncu",23-May-1974,W-F-1814/58,Superceding Date: 15-Jul-1985
W-F-1814/24,"Fuse, Cartridge, High Interrupting Capacity, Class K5 (",23-May-1974,W-F-1814/57,Superceding Date: 15-Jul-1985
W-F-1814/23,"Fuse, Cartridge, High Interrupting Capacity, Class K5 (",23-May-1974,W-F-1814/56,"Cancelled Date: 15-Jul-1985 Superceding Date: 15-Jul-1985"
W-F-1814/22,"Fuse, Cartridge, High Interrupting Capacity, Class K9 (",23-May-1974,W-F-1814/67A,"Cancelled Date: 15-Jul-1985 Superceding Date: 15-Jul-1985"
W-F-1814/21,"Fuse, Cartridge, High Interrupting Capacity, Class K9 (",23-May-1974,W-F-1814/66,Superceding Date: 15-Jul-1985
W-F-1814/20,"Fuse, Cartridge, High Interrupting Capacity, Class K9 (",23-May-1974,W-F-1814/65,Superceding Date: 15-Jul-1985
W-F-1814/19,"Fuse, Cartridge, High Interrupting Capacity, Class K9 (",23-May-1974,W-F-1814/64,"Cancelled Date: 15-Jul-1985 Superceding Date: 15-Jul-1985"
W-F-1814/18,"Fuse, Cartridge, High Interrupting Capacity, Class K9 (",23-May-1974,W-F-1814/63,Superceding Date: 15-Jul-1985
W-F-1814/17,"Fuse, Cartridge, High Interrupting Capacity, Class K9 (",23-May-1974,W-F-1814/62,"Cancelled Date: 15-Jul-1985 Superceding Date: 15-Jul-1985"
W-F-1814/16,"Fuse, Cartridge, High Interrupting Capacity, Class K9 (",23-May-1974,W-F-1814/61,"Cancelled Date: 15-Jul-1985 Superceding Date: 15-Jul-1985"
W-F-1814/15,"Fuse, Cartridge, High Interrupting Capacity, Class K9 (",23-May-1974,W-F-1814/60,"Cancelled Date: 15-Jul-1985 Superceding Date: 15-Jul-1985"
W-F-1814/14,"Fuse, Cartridge, High Interrupting Capacity, Class K9 (",23-May-1974,W-F-1814/59,Superceding Date: 15-Jul-1985
W-F-1814/13,"Fuse, Cartridge, High Interrupting Capacity, Class K9 (",23-May-1974,W-F-1814/58,"Cancelled Date: 15-Jul-1985 Superceding Date: 15-Jul-1985"
W-F-1814/12,"Fuse, Cartridge, High Interrupting Capacity, Class K9 (",23-May-1974,W-F-1814/57,Superceding Date: 15-Jul-1985
W-F-1814/11,"Fuse, Cartridge, High Interrupting Capacity, Class K9 (",23-May-1974,W-F-1814/56,"Cancelled Date: 15-Jul-1985 Superceding Date: 15-Jul-1985"
W-F-1726/GEN(1),"Fuses, Cartridge, Class H (General Specification)",11-Jun-1973,W-F-1814-61,Superceding Date: 15-Jul-1985
W-F-1726/24,"Fuse, Cartridge, Class H, Renewable, 600 Volts, 401-600 Ampe",11-Jun-1973,W-F-1814/67A,Superceding Date: 19-Nov-1986
W-F-1726/23(1),"Fuse, Cartridge, Class H, Renewable, 600 Volts, 201-400 Ampe",11-Jun-1973,W-F-1814/66,Superceding Date: 19-Nov-1986
W-F-1726/22,"Fuse, Cartridge, Class H, Renewable, 600 Volts, 101-200 Ampe",11-Jun-1973,W-F-1814/65,Superceding Date: 19-Nov-1986
W-F-1726/21,"Fuse, Cartridge, Class H, Renewable, 600 Volts, 61-100 Amper",11-Jun-1973,W-F-1814/64,Superceding Date: 19-Nov-1986
